Billing Address,Liability Start Date,Property Address,Ratepayer,Net Debit,Property Reference,RV
,01/07/2014,"Unit 3, Bridge Mill, St Georges Square, Hebden Bridge       HX7 8ET",,0,76508707,860
,09/12/2013,"3 Borough Market, Halifax, HX1 1DY",,0,64288003,3650
"Hartford Trading Estate, Suthers Street, Oldham, OL9 7TQ",05/05/2014,"Unit 17B Mill House Works, Mill House Lane, Triangle, Sowerby Bridge      HX6 3LN",Units To Let [Northern] Ltd,0,77352736,770
"Leonard Curtis, Business Rescue & Recovery, 5 Albion Court, Leeds, LS1 6JL",27/09/2014,"Ground Floor, Unit 1B Dunkirk Mills, Dunkirk Lane, Halifax              HX1 3TA",Ppc Uk Ltd (In Administration),0,64852702,2150
,01/04/2014,"Unit 1, 3 Corporation Street, Sowerby Bridge, HX6 2QQ",,1640.1,77160709,3300
,20/06/2014,"7-9 Ovenden Road, Halifax, HX3 5PN",,0,65625712,4400
,02/09/2013,"Room 2, 3 Park Street, Sowerby Bridge, HX6 2BF",,0,77697703,1250
"Belmont Garage, Rochdale Road, Sowerby Bridge, HX6 3BL",19/09/2013,"Electronic Delivery Locker, Rochdale Road, Sowerby Bridge, HX6 3BL",Belmont Service Station Ltd,459.8,77456706,950
,01/04/2014,"Unit 3 Robinwood Mill, Burnley Road, Todmorden, OL14 8JA",,0,78076852,1025
,25/01/2015,"45 Crown Street, Halifax, HX1 1JB",,0,64756045,6000
,01/11/2014,"Stall 24 Market Hall, Brook Street, Todmorden, OL14 5AJ",,0,78068715,1375
,01/01/2013,"Stall 18 Market Hall, Brook Street, Todmorden, OL14 5AJ",,0,78068711,2325
,01/05/2014,"Unit 32, Sdh Industrial Estate, West Street, Sowerby Bridge       HX6 3BS",,0,77648731,2800
,27/02/2013,"3 St Johns Lane, Halifax, HX1 2JD",,0,68740003,3800
"Unit 5.3 White Rose Mill, Holdsworth Road, Holmfield, Halifax, HX3 6SN",01/09/2014,"Room 5.3, White Rose Mill, Holdsworth Road, Halifax              HX3 6SN",Scale Model Shop Ltd,0,65344946,560
"187 Richmond Road, Accrington, Lancashire, BB5 0JB",01/09/2014,"Unit 9 (2nd Floor), Queens Road Mills, Gibbet Street, Halifax             HX1 4JX",Dawat-E-Islami,149.1,65164760,1500
,16/06/2014,"Office 39 First Floor, The E W Innovation Centre, Hopwood Lane, Halifax              HX1 5ER",Lime Tree Europe Ltd,0,64242736,1450
"Fao Stephen Jackson, Unit 2e Greenhill Ind Estate, Mytholmroyd, Hebden Bridge, HX7 5QF",01/04/2013,"Unit 2E, Greenhill Industrial Estate, Mytholmroyd, Hebden Bridge        HX7 5QF",Nimbo Ltd,1455.36,76252809,8200
,01/04/2014,"Unit 1 R/O Hill Crest Garage, Burnley Road, Sowerby Bridge, HX6 2TL",,0,77108715,2900
,14/08/2014,"Hillside Garage, Bramston Street, Brighouse, HD6 3AA",,4119.58,29088712,10750
"Units 62 & 53 Bowers Mill, Branch Road, Barkisland, Halifax, HX4 0AD",01/09/2014,"Unit 14 Bowers Mill, Branch Road, Barkisland, Halifax              HX4 0AD",Peter Jackson & Son Ltd,3291.2,64344721,6800
,17/04/2014,"Wagon & Horses Inn, 786 Rochdale Road, Todmorden, OL14 7UA",,0,78400760,5400
"Unit 2, Calder Bank, River Street, Brighouse, HD6 1LJ",01/11/2014,"River Street, Brighouse, HD6 1NH",Firth Steels Ltd,4870.6,29492710,9800
,01/01/2015,"Ground Floor Rear, 355 Halifax Road, Todmorden, OL14 5SR",,0,78192826,2325
,08/12/2014,"Unit 2 Victoria Autos, Victoria Road, Halifax, HX1 5PT",,2613.6,69196721,5400
,20/05/2014,"298/300 Ovenden Road, Halifax, HX3 5TJ",,0,68156713,1100
,01/04/2015,"Office No T04, 1ST Floor Cromwell House, Elland Road, Brighouse            HD6 2RG",Freshwater Environment Ecology Trust,0,29236810,1200
,22/05/2015,"22 Water Street, Todmorden, OL14 5AB",,0,78508022,1950
"Mile Thorn Works, Gibbet Street, Halifax, HX1 4JR",01/04/2015,"295 Claremount Road, Halifax, HX3 6AW",Maramar Holdings Ltd,1838.9,64592295,3700
,08/12/2014,"Unit 1 Victoria Autos, Victoria Road, Halifax, HX1 5PT",,0,69196720,3600
"St Aidans Chapel, Bradford Road, Bailiff Bridge, Brighouse, HD6 4EA",06/02/2015,"Unit 21 Branxholme Estate, Bradford Road, Bailiff Bridge, Brighouse           HD6 4EA",Oiltech Europe Ltd,3872,29084705,8000
,30/06/2014,"Warehouse Adj K S Chatta, Tillotson Avenue, Sowerby, Sowerby Bridge       HX6 1BX",,1234.2,77592701,2550
"Hebden Bridge Town Hall, St George's Street, Hebden Bridge, HX7 7BY",28/02/2015,"Unit 33 2ND Floor, The Town Hall, St George's Street, Hebden Bridge        HX7 7BY",Hebden Bridge Community Association,0,76500753,1925
,30/03/2015,"Middle Floor, Jowler Mill, Luddenden, Halifax              HX2 6TB",Linx Beds Ltd,0,65460701,5600
,21/03/2015,"Unit 4, 535 Bradford Road, Bailiff Bridge, Brighouse            HD6 4DL",,3242.8,29084848,6700
,28/04/2015,"Unit 4B, Topland Country Business Pk, Cragg Road, Mytholmroyd          HX7 5RU",,0,76160802,2600
,01/01/2015,"Rockwood House, Caldene Business Park, Burnley Road, Mytholmroyd          HX7 5QJ",Prodoto Photographic Studios Ltd,4646.4,76088886,9600
,12/08/2014,"72 Ovenden Road, Halifax, HX3 5PN",,629.96,65625072,7100
,01/01/2014,"Unit H Eastfield Mills, Belmont Street, Halifax, HX3 6AT",,1372.22,64236726,8100
,12/12/2014,"Unit 2 Owenshaw Mill, Old Cawsey, Sowerby Bridge, HX6 2AJ",Mad Motors Ltd,0,77404709,1650
"2 William Street, Brighouse, HD6 1HR",05/10/2014,"Ground Floor, 2 William Street, Brighouse, HD6 1HR",Klh Developments Ltd,0,29644703,3550
"Po Box 6079, Wolverhampton, WV1 9RA",01/04/2010,"Atm Site (Natwest), W M Morrison Plc, Rochdale Road, Todmorden           OL14 6LG",Natwest Bank Plc,2855.6,78400858,5900
,01/04/2015,"Office Suite D 248, Dean Clough Office Park, Halifax, HX3 5AX",Robus Group Ltd,0,64788735,1050
"Office Suite E345, Dean Clough, Halifax, HX3 5AX",20/04/2015,"Unit 2 F Mill Courtyard, Dean Clough Mills, Halifax, HX3 5AX",Dean Clough Ltd,0,64296736,5200
"Office H M 2.0, Holmfield Mills, Holdsworth Road, Halifax, HX3 6SN",01/06/2015,"12D Holdsworth Road, Holmfield, Halifax, HX3 6SN",Kino & Co,0,65344510,1725
"Office H M 2.0, Holmfield Mills, Holdsworth Road, Halifax, HX3 6SN",01/12/2014,"Unit 9 White Rose Mill, Holdsworth Road, Halifax, HX3 6SN",Kino & Co,0,65344766,2500
,01/04/2015,"Unit C7, Tenterfields Business Park, Luddendenfoot, Halifax             HX2 6EQ",,0,64448786,3250
"Westholme Road, Halifax, HX1 4JF",16/05/2015,"Ground Floor, 18 Clare Road, Halifax, HX1 2JP",Southdale Homes Ltd,3677.8,64584791,7400
,14/05/2014,"Crown Buildings, 99 Halifax Road, Ripponden, HX6 4DA",,0,77240099,3050
,02/08/2015,"Ground & First Floors, 51 Crown Street, Halifax, HX1 1JB",,0,64756736,5100
"Registered Office, 559a Wilbraham Road, Chorlton, Manchester, M21 0AE",20/04/2015,"Off 5, Pt 2ND Flr Bond Mill, The E W Innovation Centre, Hopwood Lane, Halifax              HX1 5ER",Standguide Ltd,2662,64242821,5500
"Registered Office, 559a Wilbraham Road, Chorlton, Manchester, M21 0AE",20/04/2015,"Off 3, Pt 2ND Flr Bond Mill, The E W Innovation Centre, Hopwood Lane, Halifax              HX1 5ER",Standguide Ltd,2274.8,64242820,4700
"C/O Mr David Sunderland, Chat Hill Farm, Chat Hill Road, Thornton, Bradford, BD13 3AR",01/02/2015,"1ST Flr Unit 3 Hough Mills, Bradford Road, Halifax, HX3 7BN",Unique Carpets & Rugs Ltd,0,64332711,4250
"19 Albion Street, Halifax, HX1 1DU",05/10/2014,"Market Stall 101-103, Market Hall, Borough Market, Halifax             HX1 1DZ",Calderdale Mbc Markets Manager,0,64288753,3850
,01/03/2015,"Unit 11, No 2 Warehouse, The Wharf, Sowerby Bridge, HX6 2AG",,0,77124704,2175
"Unit 1 Marshall Hall Mills, Elland Lane, Elland, HX5 9DU",01/05/2015,"Marshall Hall Mills, Elland Lane, Elland, HX5 9DU",R & D Electrical Contractors(Yorkshire) Ltd,0,56084721,2225
,01/01/2013,"Unit 3 (1st Floor), Mearclough Works, Mearclough Road, Sowerby Bridge      HX6 3LF",,0,77340713,620
,05/01/2015,"33A Stainland Road, Greetland, Halifax, HX4 8AD",,262.16,64254752,6500
,01/04/2015,"Unit B3, Tenterfields Business Park, Burnley Road, Luddendenfoot       HX2 6EQ",,0,64448769,1725
,24/02/2014,"Unit 2E, Hipperholme Business Park, Halifax Road, Hipperholme          HX3 8ER",Ashanti Ltd,0,65232768,2075
,01/08/2015,"Unit 3, 148/150 Hanson Lane, Halifax, HX1 5PQ",,2787.28,65264811,9600
,01/04/1990,"51 James Street, Elland, HX5 0HB",Autoweigh Scales (Uk) Ltd,2577.67,56144051,9400
,01/08/1997,"Unit 21 Bowers Mill, Branch Road, Barkisland, Halifax             HX4 0AD",,0,64344716,1275
,01/08/1997,"Unit 5, Brunswick Works, Brassey Street, Halifax             HX1 2EA",Complete Packaging Sevices Ltd,2894.44,64352710,9700
"26 Northgate, Elland, West Yorks, HX5 0RU",29/06/1999,"1st Floor, 32 Northgate, Elland, HX5 0RU",Joseph Dobson & Sons Ltd,617.1,56180707,1275
,01/04/2002,"Adj Southedge Works, Brighouse Road, Hipperholme, Halifax              HX3 8EF",,0,64376726,3900
"Office Suite E345, Dean Clough, Halifax, HX3 5AX",15/01/2002,"Car Park Adj Bowling Mill, Dean Clough Mills, Halifax, HX3 5AX",Dean Clough Ltd,1452,64784876,3000
"Leisure Services, Westgate House, Westgate, Halifax, HX1 1PS",01/04/1990,"Brighouse Cemetery, Lightcliffe Road, Brighouse, HD6 2HY",Director Of Safer & Stronger Communities,3146,29384706,6500
,01/04/1996,"Bull Green, Luddendenfoot, Halifax, HX2 6JJ",,1173.7,64438700,2425
,14/11/1997,"3 Owler Ings Road, Brighouse, HD6 1EJ",J & E Computers Ltd,0,29452003,5200
"C/O Cushman & Wakefield, National Rating Team, St Paul's House, 23 Park Square South, Leeds, LS1 2ND",01/04/1990,"18/20 Southgate, Elland, HX5 0BP",Clydesdale Bank Plc,4646.4,56224719,9600
"Regen & Development, Northgate House, Northgate, Halifax, HX1 1UN",01/04/1990,"Opp 94 Southgate, Elland, HX5 0ET",Calderdale Mbc,1161.6,56224724,2400
,01/04/1990,"Warley Springs Garage, Burnley Road, Halifax, HX2 7NB",,0,64452703,5700
,01/04/1990,"17 Bradford Road, Brighouse, HD6 1RW",H.Marsden (Brighouse) Ltd,0,29080017,8200
,01/04/1990,"Ship Street, Brighouse, HD6 1JX",,3267,29512701,6750
"The Smithy, Smithy Carr Lane, Brighouse, HD6 2HL",01/04/1990,"The Smithy, Smithy Carr Lane, Brighouse, HD6 2HL",John Walton (Machine Tools) Ltd,49.22,29528700,6100
,01/04/1990,"16 Thornhill Bridge Lane, Brighouse, HD6 4AW",Clean Car Ltd,0,29564016,5100
,13/08/1999,"Thornhill Bridge Lane, Brighouse, HD6 4AW",,1372.22,29564700,8100
,22/05/2000,"7 Carlton Street, Halifax, HX1 2AL",,0,64488007,5900
,01/04/1990,"14 Carr House Road, Shelf, Halifax, HX3 7QY",Shelf Pharmacy Ltd,0,64500014,4950
,01/04/1990,"1/3 Carr House Road, Shelf, Halifax, HX3 7QY",,3812.47,64500706,10500
"Stevenson House, 9 Cemetery Lane, Burnley, BB11 5DG",01/04/1990,"2 Chapel Lane, Salterhebble, Halifax, HX3 0QN",H Stevenson & Son Ltd,992.2,64532002,2050
,01/04/1990,"Victoria Works, Allerton Place, Halifax, HX1 5JJ",,1372.22,64068700,8100
,01/04/1990,"4 Clare Road, Halifax, HX1 2HX",,0,64584004,5400
,01/06/1995,"609 Bradford Road, Bailiff Bridge, Brighouse, HD6 4DN",,0,29084609,4000
,31/07/2000,"299 Claremount Road, Halifax, HX3 6AW",,0,64592299,3550
,01/04/1990,"Claremount Road, Halifax, HX3 6AW",,0,64592700,2250
"109 Lidget Street, Lindley, Huddersfield, HD3 3JR",31/12/2000,"104a Briggate, Brighouse, HD6 1EL",Hartleys Confectioners Ltd,0,29100706,2550
,01/04/1990,"Rastrick Tennis Club, Carr Green Lane, Rastrick, Brighouse           HD6 3LT",,2081.99,29132701,8900
"Regen & Development, Northgate House, Northgate, Halifax, HX1 1UN",01/04/1990,"Brook Street, Elland, HX5 9AW",Calderdale Mbc,1161.6,56024700,2400
"Finance Section, Bull Green House, Bull Green, Halifax, HX1 2EB",01/04/2002,"5 Croft House, Crown Street, Elland, HX5 0DB",Pennine Housing 2000 Ltd,1234.2,56060702,2550
,09/06/1992,"Elland Lane, Elland, HX5 9ER",,1714.18,56084706,8500
"Leisure Services, Westgate House, Westgate, Halifax, HX1 1PS",01/04/1990,"Elland Cemetery, Exley Lane, Elland, HX5 0SW",Director Of Safer & Stronger Communities,1500.4,56096701,3100
"Nndr Dept, Orion Gate, Guildford Road, Woking Surrey, GU22 7NJ",01/04/1995,"Board No 0702 0038, Nr 128 Boothtown Road, Halifax, HX3 6HG",Clear Channel (Uk) Ltd,232.32,64284720,480
,18/03/1996,"34 Borough Market, Halifax, HX1 1DY",,0,64288034,3600
,01/04/1990,"66 Commercial Street, Brighouse, HD6 1AQ",,1043.7,29196066,10500
"Rivington Road, Whitehouse Ind Est, Runcorn, Cheshire, WA7 3DJ",01/04/1990,"98 Commercial Street, Brighouse, HD6 1AQ",L Rowland & Co (Retail) Ltd,5203,29196098,10750
,18/12/2000,"Market Stall 9-12, Market Hall, Borough Market, Halifax             HX1 1DZ",,2178,64288711,9000
"Fao Paul Ward Finance Manager, 3rd Floor, Westgate House, Halifax, HX1 1PS",01/04/1990,"Forest Cottage Comm Centre, Cousin Lane, Halifax, HX2 8AD",Calderdale Mbc Children & Young People's Services,738.1,64696701,1525
,04/05/1992,"10 Cow Green, Halifax, HX1 1JF",,0,64700010,4650
,01/04/1990,"Greystones, Wheatley, Halifax, HX2 8TX",,0,64712700,2900
,01/04/1990,"Turner Court Works, Boothtown, Halifax, HX3 6TS",Halls Decorating & Painting Contractors Ltd,1161.6,69120700,2400
,01/04/1990,"222/224 Rochdale Road, Greetland, Halifax, HX4 8JE",,0,68392222,6000
,01/04/1990,"Park Garage, Rochdale Road, Greetland, Halifax             HX4 8AL",D Pitchforth Ltd,0,68392721,4300
,01/01/1995,"Opp 162 Rochdale Road, Greetland, Halifax, HX4 8JE",,0,68392726,930
,01/04/1990,"Upper Brockholes Farm, Upper Brockholes, Ogden, Halifax             HX2 8XG",,0,69152700,1700
,01/04/1990,"18 Hall Street, Halifax, HX1 5BD",,2202.2,65248018,4550
,03/12/1993,"1 Roydlands Terrace, Hipperholme, Halifax, HX3 8NG",,0,68416001,3250
,01/04/1990,"13 Wainhouse Road, Halifax, HX1 3RT",,0,69224013,2650
,01/08/2001,"Star Garage, Wakefield Road, Copley, Halifax             HX3 0TP",,0,69240714,950
,01/04/1990,"105a Wakefield Road, Lightcliffe, Halifax, HX3 8SH",,0,69248105,3200
,01/04/1990,"High Lee Green, Luddendenfoot, Halifax, HX2 6LD",,0,65320700,2325
,01/06/2002,"White Rose Mill, Holdsworth Road, Holmfield, Halifax              HX3 6SN",,5687,65344712,11750
,01/04/1990,"Savile Park Road, Halifax, HX1 2EN",Balmoral Garage Ltd,0,68472702,5600
"C/O Bilfinger Gva, Po Box 6079, Wolverhampton, WV1 9RA",01/04/2000,"Telecomms Mast, Site Ref WYK0178, Savile Park Road, Halifax              HX1 2XH",Everything Everywhere Ltd,0,68472718,8900
"Fao Paul Ward Finance Manager, 3rd Floor, Westgate House, Halifax, HX1 1PS",01/04/2001,"Holdsworth Road, Halifax, HX2 9TH",Calderdale Mbc Children & Young People's Services,1452,65348713,3000
"C/O Ctil, Rate A/C Management, Colliers Int Rating Uk Llp, 12th Floor, 11 Brindley Place, 2 Brunswick Square, Brindley Place, Birmingham, B1 2LP",01/04/2000,"Telecomminications Mast, Site Ref  3891, Shaw Lodge, Halifax              HX1 2NA",Vodafone Ltd,4065.6,68528700,8400
"Sarah Oldknow, Company Administrator, Yorkshire Youth And Music, Dean Clough, Halifax, HX3 5AX",23/10/2000,"Office Suite E 125, Dean Clough Mills, Halifax, HX3 5AX",Yorkshire Youth & Music Ltd,497,64788813,5000
"Mr John N Clay, B M Howarth Ltd, West House, King Cross Road, Halifax, HX1 1EB",01/04/1990,"Dean Street, Greetland, Halifax, HX4 8DW",Greetland & District Trading Soc Ltd,3180.8,64800701,6400
,29/09/2001,"1a Ovenden Road, Halifax, HX3 5PN",,0,68156705,5100
"Nndr Dept, Orion Gate, Guildford Road, Woking Surrey, GU22 7NJ",01/04/2000,"Advertising Right 0702 0007, Frt 354 Ovenden Road, Halifax, HX3 5TJ",Clear Channel (Uk) Ltd,232.32,68156714,480
,01/04/1990,"58 Oxford Lane, Siddal, Halifax, HX3 9BJ",,0,68168058,1175
"Simpson Street, Boothtown, Halifax, HX3 6PA",01/04/1999,"Simpson Street, Boothtown, Halifax, HX3 6PA",Cosmadent Dental Laboratory Ltd,2276.19,68584700,9100
,08/02/1991,"189 King Cross Road, Halifax, HX1 3LN",,152.46,65516189,6300
,01/04/1990,"226 Pellon Lane, Halifax, HX1 5RU",,0,68236226,3350
,01/08/1999,"36 Pellon Lane, Halifax, HX1 5SP",,0,68236726,2650
,01/04/1990,"40 South Parade, Halifax, HX1 2LY",,0,68632040,2150
,01/12/1998,"Ellen Holme Lane, Luddendenfoot, Halifax, HX2 6EP",,5101.74,65020720,11500
,29/06/2000,"Valeson House, 190 King Cross Road, Halifax, HX1 3LN",,1056.06,65516714,7700
"Rates Administrator, Estates Management, Summit House, 27 Sale Place, London, W2 1YR",01/04/1996,"Board No 2370, Pellon Lane, Halifax, HX1 5SP",Jc Decaux Ltd,544.5,68236744,1125
,01/04/1990,"54 New Lane, Halifax, HX3 9AL",,0,68248700,3750
,26/10/2002,"10 Spring Hall Lane, Halifax, HX1 4TX",,0,68680010,2050
,01/04/1990,"The Playhouse, King Cross Street, Halifax, HX1 2SH",,825.02,65520703,8300
"Leisure Services, Westgate House, Westgate, Halifax, HX1 1PS",01/04/1990,"Between 52 And 53, Arcade, Piece Hall, Halifax             HX1 1RE",Director Of Safer & Stronger Communities,0,68252710,3650
"Tuck Royd Quarry, Halifax Road, Brighouse, HD6 2PL",01/04/1990,"St Giles Road, Lightcliffe, Halifax, HX3 8BP",Rand & Asquith Stone Sales Ltd,3630,68720702,7500
"Regen & Development, Northgate House, Northgate, Halifax, HX1 1UN",01/04/1990,"N/R Kingdom Hall, Lambert Street, Greetland, Halifax              HX4 8AA",Calderdale Mbc,1016.4,65560701,2100
,17/06/1997,"5 Lane Ends, Shibden, Halifax, HX3 7UW",,0,65566005,1500
,10/04/2000,"Mozart House, 34 & 34a Prescott Street, Halifax, HX1 2QW",,2137.1,68280034,4300
,01/04/1990,"3 Coleridge Street, Halifax, HX1 2JF",,438.82,68280701,6800
,01/04/1990,"3 St James Street, Halifax, HX1 5SU",,1455.36,68736003,8200
,01/06/2002,"Adj 229 Gibbet Street, Halifax, HX1 5JE",R A Sidebottom Ltd,2613.6,65164798,5400
,26/05/1998,"Unit 8, Lee Bridge Industrial Estate, Lee Bridge, Halifax             HX3 5AT",,0,65600720,8000
,15/09/1999,"7 Leeds Road, Hipperholme, Halifax, HX3 8ND",,0,65616007,4800
,01/04/1990,"The Maurice Jagger Centre, Lister Street, Halifax, HX1 1UZ",,259.43,65656701,8700
"Regen & Development, Northgate House, Northgate, Halifax, HX1 1UN",01/04/1990,"S/O Red Lion, Stainland Road, Sowood, Stainland, Halifax              HX4 0AQ",Calderdale Mbc,1790.8,68780701,3700
,07/09/2001,"62 Gibbet Street, Halifax, HX1 5BP",,500.91,65164841,6900
,01/04/1995,"Long Lane, Southowram, Halifax, HX3 9UD",,251.68,65664700,1300
"Fao Shabbir Suleman, Westgate House, Westgate, Halifax, HX1 1PS",01/04/1990,"Northowram Branch Library, Lydgate, Northowram, Halifax             HX3 7EJ",Calderdale Mbc Leisure Services,5445,65728700,11250
,01/04/1990,"Rear 296 Queens Road, Halifax, HX1 4NS",,1669.8,68308742,3450
,01/08/1998,"Ellen Royd Playing Fields, Range Bank, Halifax, HX3 6JR",,61.63,68328700,1550
,01/04/1990,"Swales Moor Forge, Swales Moor Road, Halifax, HX3 6UF",,0,68908703,2900
"Spring Hill Quarry, Rochdale Road, Greetland, Halifax, HX4 8PS",01/04/1990,"Spring Hill Quarry, Barkisland, Halifax, HX4 8LJ",Springhill Stone Ltd,605,65212701,1250
"991 Great West Road, Brentford, TW8 9DN",01/04/1990,"Advertising Right, 105 Haley Hill, Halifax, HX3 6EE",J C Decaux Uk Ltd,392.04,65224105,810
"Unit 4-5, 38 Roman Ridge Road, Sheffield, S9 1GB",01/04/1990,"Unit 1, Halifax Industrial Centre, Marshway, Halifax             HX1 5RW",Adel (C & C) Ltd,5082,65752700,10500
,01/04/1990,"Martins Mill Yard, Richmond Road, Halifax, HX1 5SZ",,0,68376701,3500
,01/04/1998,"23 Towngate, Southowram, Halifax, HX3 9QZ",,0,69088701,1125
,19/03/2001,"Crescent Mill, Foundry Street, Todmorden, OL14 7LR",,0,78164709,3950
,01/04/1990,"Unit 20, Mill House Works, Mill House Lane, Triangle            HX6 3LN",,1403.6,77352712,2900
,01/04/2002,"Unit 30, Mill House Works, Mill House Lane, Triangle            HX6 3LN",,0,77352714,1750
,01/04/1990,"Unit 6, Mill House Works, Mill House Lane, Triangle            HX6 3LN",,0,77352720,1800
,01/04/1995,"46 Halifax Road, Todmorden, OL14 5QG",,0,78192046,2750
,23/09/1996,"Colden Childrens Club, Lower Smithy, Colden, Hebden Bridge       HX7 7HP",,0,76346700,2225
,07/06/1996,"Telecommunications Mast, Ref 1943 Adj Little London, Oldham Road, Rishworth            HX6 4QG",,3049.2,77412725,6300
,01/04/1990,"191 Rochdale Road, Sowerby Bridge, HX6 2SJ",,0,77456191,1225
,07/10/2002,"22 Halifax Road, Todmorden, OL14 5QG",,0,78192783,5300
,01/04/1990,"East View House, Jumps Road, Todmorden, OL14 8HL",,0,78244701,3250
,01/04/1990,"Hawk Mount Garage, Kebs Road, Todmorden, OL14 8SB",,0,78248700,3300
"Mailbox 3, Corporate & Technical Centre, 4000 Parkway, Whiteley, Fareham, PO15 7FL",01/04/1990,"Keb Cote, Kebs Road, Todmorden, OL14 8SB",National Air Traffic Services Ltd [Group Property Services],4307.6,78248701,8900
"Regen & Development, Northgate House, Northgate, Halifax, HX1 1UN",01/04/1990,"Adj Victoria Hall, Royd Lane, Ripponden, Sowerby Bridge       HX6 4BG",Calderdale Mbc,1452,77472700,3000
"Rishworth School, Oldham Road, Rishworth, Sowerby Bridge, HX6 4QA",01/04/1990,"Rishworth School Chapel, Shaw Lane, Rishworth, Sowerby Bridge       HX6 4QA",Rishworth School Trustees,357.84,77496700,3600
,14/05/2001,"Unit 13, Washer Lane Works, Washer Lane, Halifax             HX2 7DX",,0,69296704,3900
,31/05/1996,"8 Waterhouse Street, Halifax, HX1 1UQ",,0,69304008,5200
"Rivington Road, Whitehouse Industrial Estate, Runcorn, WA7 3DJ",14/04/2000,"25 Town Hall Street, Sowerby Bridge, HX6 2EA",L Rowland & Co [Retail] Ltd,2420,77600025,5000
"19 High Street, Earls Barton, Northampton, NN6 0JG",01/04/1990,"Union Street South, Halifax, HX1 2LD",Columbia Metals Ltd,4646.4,69324703,9600
,01/04/1990,"Old Town, Hebden Bridge, HX7 8SW",,193.6,76420700,400
,14/10/1992,"Mount Shed, Mytholmroyd, Hebden Bridge, HX7 5LT",,2420,76444711,5000
"Lloyds Banking Group, C/O Cbre Corporate Outsourcing Ltd, 55 Temple Row, Birmingham, B2 5LS",01/04/1990,"Town Hall Street, Sowerby Bridge, HX6 2DZ",Lloyds Bank Plc,5687,77600700,11750
,11/03/1998,"11 Towngate, Sowerby, Sowerby Bridge, HX6 1HT",,0,77604011,2025
,01/04/1990,"Unit 1b, Walsden Industrial Estate, Rochdale Road, Todmorden           OL14 6UD",Cadismoor Ltd,1714.18,78400731,8500
,01/04/1990,"West View Garage, Boothtown, Halifax, HX3 6PG",,1766.6,69372702,3650
,01/04/1993,"Scout Bottom Farm, Mytholmroyd, Hebden Bridge, HX7 5JS",,0,76466700,2150
,01/04/1990,"Slack Top, Heptonstall, Hebden Bridge, HX7 7HA",,387.66,76480700,3900
,01/04/1990,"The Band Room, Water Hill Lane, Sowerby Bridge, HX6 2UA",,0,77640700,2500
"Calderbank Nurseries, Walsden, Todmorden, OL14 7TG",01/04/1990,"Car Park, Near Travis House, Rochdale Road, Todmorden           OL14 6LD",Gordon Rigg (Nurseries) Ltd,0,78400779,1000
"Crown Works, 45 Rochdale Road, Todmorden, Lancashire, OL14 6LD",20/07/2000,"Unit 3, Salford Industrial Estate, Salford, Todmorden           OL14 7LF",J D F Restoration Ltd,1427.8,78408704,2950
,01/04/1992,"Houghgate Head Farm, Withens Road, Wainstalls, Halifax              HX2 7UA",,0,69454700,2375
"Station Road, Hebden Bridge, HX7 6JE",01/04/1990,"Station Yard, Hebden Bridge, HX7 6JE",Matthew Sheard And Sons Ltd,100.02,76512704,6200
,01/04/1990,"Towngate, Heptonstall, Hebden Bridge, HX7 7NB",,1887.6,76540700,3900
,01/04/1990,"Stag Fold, Heptonstall, Hebden Bridge, HX7 7LW",,726,76540708,1500
"Nndr Dept, Orion Gate, Guildford Road, Woking Surrey, GU22 7NJ",01/04/2000,"Opp Ryburn Buildings, West Street, Sowerby Bridge, HX6 3AP",Clear Channel (Uk) Ltd,290.4,77648705,600
"Fao Mr G Backhurst, 17 West Street, Oundle, Nr Peterbourgh, Cambridge, PE8 4EJ",02/03/1999,"Baltimore Marina, Stackhills Road, Todmorden, OL14 5QW",Baltimore Boats Ltd,1071.05,78432703,8500
,01/04/1990,"6 Station Road, Todmorden, OL14 8JR",,1234.2,78452700,2550
,01/04/1990,"Vale Street, Todmorden, OL14 5HG",,0,78500700,3800
,03/03/1997,"37 West End, Hebden Bridge, HX7 8UQ",,0,76576037,5100
,14/12/1998,"Victoria Road, Todmorden, OL14 5LP",,0,78504700,870
,01/04/1990,"11 Water Street, Todmorden, OL14 5AB",,0,78508011,3400
,01/04/1996,"20 Water Street, Todmorden, OL14 5AB",,0,78508020,2100
,01/04/1990,"Outlane Bowling Club, Stainland Road, Outlane, Huddersfield        HD3 3YU",,0,79044702,4050
,01/04/1990,"Boston Hill, Wadsworth, Hebden Bridge, HX7 8SS",,726,76052700,3750
,01/04/1990,"13 Bridge End, Burnley Road, Mytholmroyd, Hebden Bridge        HX7 5DR",,0,76056013,1500
,01/04/1990,"12 Bridge Gate, Hebden Bridge, HX7 8EX",,1118.25,76060012,11250
,01/04/1990,"30 Burnley Road, Todmorden, OL14 5EZ",,0,78076030,3450
,01/05/1997,"Unit 5 R/O Hill Crest Garage, Burnley Road, Sowerby Bridge, HX6 2TL",,0,77108714,2125
,07/01/2003,"Hollins Mill, Rochdale Road, Todmorden, OL14 6SA",,907.5,78400704,7500
,29/05/1993,"Chapel Lane, Sowerby Bridge, HX6 3LF",,0,77144700,5600
,01/04/1990,"714 Burnley Road, Todmorden, OL14 8LF",,0,78076760,2750
,01/04/1990,"Glen View Inn, 853 Burnley Road, Todmorden, OL14 7EW",,0,78076773,4000
,20/05/2002,"13 Town Hall Street, Sowerby Bridge, HX6 2EA",,0,77600013,3800
,01/04/1990,"Cragg Holme Mill, Off Cragg Road, Mytholmroyd, Hebden Bridge        HX7 5SQ",,0,76160705,3150
"Unit 1 Albert Mills, Gratix Lane, Sowerby Bridge, HX6 2DH",01/10/1996,"Unit 1, Albert Mills, Gratrix Lane, Sowerby Bridge      HX6 2DH",Dale Stephenson Ltd,0,77232700,6000
,20/08/1992,"242 Halifax Road, Ripponden, Sowerby Bridge, HX6 4BG",,0,77240242,2700
"End Copperas House, Todmorden, OL14 7PU",01/04/1990,"Copperashouse Mill, Copperashouse Terrace, Todmorden, OL14 7PU",Copras Chemical Co Ltd,100.02,78104701,6200
,01/04/1990,"Holmes Road, Sowerby Bridge, HX6 3LF",,0,77284700,3200
,01/04/1990,"2 Ladstone Towers, Tower Hill, Sowerby Bridge, HX6 2QW",,0,77297700,3200
,01/04/1990,"Hill Crest Bowling Club, Langton Street, Sowerby Bridge, HX6 2EX",,0,77308700,4000
"Unit 9 Westpoint Enterprise Pk, Clarence Avenue, Trafford Park, Manchester, M17 1QS",01/04/2003,"Advertising Right, Gable, 1 Club Lane, Ovenden, Halifax              HX2 8AF",Primesight Ltd,116.16,64628740,240
"320 Regent Street, London, W1B 3BE",01/04/2004,"Ad Rt Adm'Ia Bd 2420-2426 Wb, Hartshead Moor Service Area, Hartshead Moor, Brighouse            HD6 4JX",Admedia Ltd,1101.1,29308716,2275
,16/10/2005,"Balcony Store 1, Borough Market, Halifax, HX1 1DZ",,166.98,64288774,345
"90 Priestley Street, Warrington, Cheshire, WA5 1ST",01/04/2004,"Office Suite D234, Dean Clough Office Park, Halifax, HX3 5AX",Rock Chemicals Ltd,1137.4,64788799,2350
,01/04/2003,"40 Town Hall Street, Sowerby Bridge, HX6 2EA",,0,77600040,3400
,01/04/2004,"The Chalet, Adj Cairnacre, Midgehole Road, Hebden Bridge        HX7 7AL",,0,76368707,1300
,01/02/2005,"Central Garage, Stansfield Road, Todmorden, OL14 5DL",Guest Automotive Ltd,2276.19,78444704,9100
,01/04/2005,"1st Floor, 32 Bell Hall Terrace, Halifax, HX1 3EE",,0,64228700,930
