Billing Address,Liability Start Date,Property Address,Ratepayer,Net Debit,Property Reference,RV
"276 Huddersfield Road, Halifax, HX3 0PF",01/11/2013,"276 Huddersfield Road, Halifax, HX3 0PF",2 Degree Field Ltd,0,65412276,2700
,01/02/2015,"257 King Cross Road, Halifax, HX1 3JL",,262.16,65516781,6500
"Bull Green House, Bull Green, Halifax, HX1 2EB",30/01/2015,"Unit 1, Akroyd Court, Halifax, HX3 6DG",Pennine Housing 2000,5715.5,64032700,11500
,01/08/2014,"Unit 3, Nanholme Workshops, Halifax Road, Todmorden           OL14 6DA",,0,78192740,890
,01/05/2014,"Unit 17B Mill House Works, Mill House Lane, Triangle, Sowerby Bridge       HX6 3LN",,0,77352750,2350
"Asset Management Cafm, 1st Floor, Northgate House, HX1 1UN",01/04/2010,"Tod'N Town Council PT1ST Flr, Todmorden Community College, Burnley Road, Todmorden           OL14 7BX",Calderdale Mbc,1306.8,78076504,2700
,20/04/2015,"Unit 4 F Mill Courtyard, Dean Clough Mills, Halifax, HX3 5AX",,438.82,64296737,6800
,14/06/2015,"18 West Park Street, Brighouse, HD6 1DU",Dermace Training & Supplies Ltd,3097.6,29628701,6400
,01/02/2015,"Gf Unit 1 Hough Mills, Bradford Road, Halifax, HX3 7BN",,100.02,64332712,6200
,06/07/2015,"The Flying Dutchman, 10 Boothtown Road, Halifax, HX3 6HG",,2662,64284709,5500
,20/07/2015,"232 King Cross Road, Halifax, HX1 3JP",,0,65516232,5500
"19 Albion Street, Halifax, HX1 1DU",01/11/2014,"Market Stall 94-95a, Market Hall, Borough Market, Halifax             HX1 1DZ",Calderdale Mbc Markets Manager,0,64288750,7200
,28/03/2015,"King Street, Todmorden, OL14 6LX",,1317.05,78288701,2650
"46A Bradford Road, Brighouse, HD6 1RY",27/06/2015,"46 Bradford Road, Brighouse, HD6 1RY",Starcast Productions Ltd,2178,29080717,4500
,09/10/2014,"200 Queens Road, Halifax, HX1 4NE",,0,68308757,5400
,01/04/2015,"42 Meadow Lane, Wheatley, Halifax, HX3 5JR",,0,65780042,4000
"Unit 21 The Coach House, Owler Ings Road, Brighouse, HD6 1EJ",08/05/2015,"37/39 Broad Street, Halifax, HX1 1YA",Thai Halifax Limited,1539.75,64400720,8300
"St Bernards Mill, Gelderd Road, Gildersome, Leeds, LS27 7NA",26/05/2015,"Suite D 1ST Floor, Clifton Mills, Bradford Road, Brighouse            HD6 4EJ",Blackshaw Holdings Ltd,0,29084853,1800
,01/04/2015,"85 Highfield Road, Rastrick, Brighouse, HD6 3JA",,2485,29328703,5000
"1 Howcans Lane, Halifax, HX3 6UD",07/12/2015,"Unit A1A/A1B, Lower Ladyship Mills, Old Lane, Halifax              HX3 5QN",John Crossley And Sons Limited,0,68132770,3700
"Fao Helen Tordoff, 16 Willow Dene Avenue, Rochdale Road, Halifax, HX2 7NN",15/07/2015,"17 Wakefield Road, Hipperholme, Halifax, HX3 8AA",Cats Protection,5342.75,69244017,10750
,01/12/2015,"Unit 14A Woodman Works, South Lane, Elland, HX5 0PA",Calder Sheetmetal Ltd,2952.4,56220819,6100
"Rates Administrator, Estates Management, Summit House, 27 Sale Place, London, W2 1YR",01/04/1996,"Gable 1 Elm Terrace, Brighouse, HD6 4BR",Jc Decaux Ltd,392.04,29240700,810
"Nndr Dept, Orion Gate, Guildford Road, Woking Surrey, GU22 7NJ",01/04/1990,"Adj 99 Huddersfield Road, Elland, HX5 9AA",Clear Channel (Uk) Ltd,474.32,56132772,980
,01/01/1997,"Rear 59 Huddersfield Road, Elland, HX5 9AA",,0,56132773,2550
,01/04/1990,"Unit 2, The Tannery, Bradford Road, Halifax             HX3 7HR",,0,64332704,780
,25/04/1997,"6A St Pauls Buildings, Langdale Street, Elland, HX5 0EX",,0,56156701,2200
"Parking Services, Mulcture House, Mulcture Hall Road, Halifax, HX1 1SP",01/04/1990,"Car Park, Church Lane, Brighouse, HD6 1DL",Regeneration And Development,2129.6,29288700,4400
,01/06/1998,"Dundee Farm, Brighouse&Denholmegate Rd, Shelf, Halifax             HX3 7TG",,0,64380703,1600
"C/O Rate Account Management, Colliers Int Rating Uk Llp, 12th Flr Eleven Brindleyplace, 2 Brunswick Square, Brindleyplace Birmingham, B1 2LP",01/04/1990,"44 Huddersfield Road, Brighouse, HD6 3RA",Co-Operative Group Ltd,2904,29344044,6000
,03/10/1994,"7 King Street, Brighouse, HD6 1NX",Huddersfield Leather Goods Ltd,3000.8,29372007,6200
"Park Road Mills, Park Road, Elland, HX5 9HX",01/08/2001,"Park Road Mills, Park Road, Elland, HX5 9HX",Benjamin Whiteley & Sons Ltd,0,56192725,3600
,01/10/2002,"Providence House, Providence Street, Elland, HX5 9DW",Providence Day Nursery Ltd,2682.61,56194700,9500
,01/10/2001,"16 Mary Street, Brighouse, HD6 2BT",,5203,29412016,10750
,01/04/1990,"Unit 5 Woodman Works, South Lane, Elland, HX5 0PA",,0,56220725,1100
"Cbre Corporate Outsourcing Ltd, 55 Temple Row, Birmingham, B2 5LS",01/04/1990,"1 Southgate, Elland, HX5 0BN",Barclays Bank Plc,5082,56224001,10500
,09/11/1998,"35/37 Southgate, Elland, HX5 0BW",,106.85,56224037,10750
,14/02/1991,"King Cross Garage, Burnley Road, Halifax, HX2 7JG",,0,64444701,5900
,01/04/1990,"54 Southgate, Elland, HX5 0DQ",,0,56224714,3200
,20/04/1995,"8 The Cross, Westgate, Elland, HX5 0BB",,319.44,56228008,6600
"Parking Services, Mulcture House, Mulcture Hall Road, Halifax, HX1 1SP",01/04/1990,"Opp 1 Parsonage Lane, Brighouse, HD6 1FB",Regeneration And Development,1718.2,29464700,3550
"Northgate House, Northgate, Halifax, HX1 1UN",07/04/1997,"Timber Street, Elland, HX5 0EA",Calderdale Mbc Environmental Services,1306.8,56232700,2700
,01/04/1990,"11 Victoria Road, Elland, HX5 0AB",,1987.51,56244011,8800
"29 Bradford Road, Brighouse, HD6 1RW",01/09/1997,"1ST Floor, 29/31 Bradford Road, Brighouse, HD6 1RW",Taylors Training Ltd,2395.8,29080031,4950
,02/08/1999,"Albert Road, Halifax, HX2 0BY",,0,64040700,2700
,01/03/1997,"55a Carr House Lane, Shelf, Halifax, HX3 7RH",,5566,64500715,11500
,01/04/1990,"6 Church Lane, Southowram, Halifax, HX3 9TD",,0,64568006,1175
,14/09/1998,"141/143 Bradford Road, Brighouse, HD6 4AD",,629.96,29080141,7100
,01/05/2000,"65a Bradford Road, Brighouse, HD6 1RS",,2662,29080723,5500
,07/09/1992,"Grey Shed   Springvale Works, Elland Road, Brighouse, HD6 2RN",,3226.68,29112703,10000
,01/04/1990,"1 Coronation Street, Elland, HX5 0DF",,0,56052001,2700
,01/04/1990,"Spa Well, Dewsbury Road, Elland, HX5 9AZ",,0,56064702,2900
,01/04/1990,"Clevedon Place, Lee Mount, Halifax, HX3 5QA",E Feather Ltd,0,64604701,4250
,04/01/2000,"Tenterfields, Clevedon Place, Halifax, HX3 5QA",,1379.4,64604704,2850
,01/10/2001,"16 Commercial Street, Halifax, HX1 1TA",,2276.19,64660016,9100
,25/12/1993,"Cliffe Works, Cliffe Road, Brighouse, HD6 1HE",,0,29172701,4550
,01/04/1990,"6 Commercial Street, Brighouse, HD6 1AQ",Huddersfield Leather Goods Ltd,3533.2,29196006,7300
"C/O Bilfinger Gva, Po Box 6079, Wolverhampton, WV1 9RA",01/04/1997,"Telecommunications Mast, Site Ref Wyk 0017, Exley Lane, Elland               HX5 0SW",Everything Everywhere Ltd,3726.8,56096705,7700
,01/04/1990,"Adj Parkfield Garage, George Street, Elland, HX5 0NE",Mel Green Construction Ltd,0,56108700,1175
,01/04/1990,"Old Rishworthians Rufc, Copley Lane, Halifax, HX3 0UG",,0,64680701,8200
"Nndr Dept, Orion Gate, Guildford Road, Woking Surrey, GU22 7NJ",01/04/1990,"Advertising Right, Halifax Road, Elland, HX5 0SH",Clear Channel (Uk) Ltd,556.6,56116710,1150
,14/10/1996,"Market Stall 41-42, Market Hall, Borough Market, Halifax             HX1 1DZ",,2105.4,64288726,4350
,01/04/1992,"Market Stall 75-76, Market Hall, Borough Market, Halifax             HX1 1DZ",,0,64288740,4850
,01/04/1997,"43 Crossley Hill, Halifax, HX3 0PL",,2081.99,64744043,8900
,01/06/2000,"Unit 12, Hansonlane Enterprise Centre, Hanson Lane, Halifax             HX1 5PG",Scoffers (Yorkshire) Ltd,0,65264734,3450
,01/09/1995,"27 Union Street, Halifax, HX1 1PR",Ace Domestics Ltd,49.22,69144027,6100
,02/07/2001,"35 Union Street, Halifax, HX1 1PR",,0,69144035,5700
"A Johnson - Group Prop Manager, Marshalls Plc, Landscape House, Premier Way, Lowfields Business Park, Elland, HX5 9HT",31/12/2001,"Hall Ings, Southowram, Halifax, HX3 9RQ",Marshalls Mono Ltd,0,65240700,2425
,01/04/1990,"Masonic Lodge, Roydlands Street, Hipperholme, Halifax             HX3 8AF",,262.16,68412700,6500
"11 Wade House Road, Shelf, Halifax, HX3 7PB",01/04/1990,"Opp 11 Wade House Road, Shelf, Halifax, HX3 7PF",Exhaust Ejector Company Ltd,324.28,69216713,670
,21/03/1992,"70 Saddleworth Road, Greetland, Halifax, HX4 8AG",,0,68444070,3550
,01/04/1990,"Brian Royd Mills, Saddleworth Road, Greetland, Halifax              HX4 8NF",Holmbridge Engineering Co Ltd,1539.75,68444704,8300
"C/O Mrs S Walker, 6 Kell Lane, Wainstalls, Halifax, HX2 7UN",01/04/1990,"Folly Hall Road, Wainstalls, Halifax, HX2 7TE",Wainstalls Sports & Social Club Ltd,0,69228700,1025
,01/08/1999,"Telecommunications Mast, Site Ref  WYK0172, Denholmegate Road, Hipperholme",,0,69240713,5300
,01/04/1990,"89 Northgate, Halifax, HX1 1XF",,0,68096089,2650
,01/04/1990,"105 Northgate, Halifax, HX1 1XF",,1803.48,68096105,8600
,14/04/1993,"Sandbeds Pharmacy, Sandbeds Road, Pellon, Halifax             HX2 0JF",Sandbeds Pharmacy Ltd,0,68456701,4300
"24 Savile Park Road, Halifax, HX1 2EN",17/11/1998,"Carlton Works, The Boulevard, R/O 24 Savile Park Road, Halifax             HX1 2EN",Pickles Printing Co Ltd,3194.4,68472710,6600
,01/04/1990,"Caravan Park, Upper Abbots Royd, Barkisland, Halifax             HX4 0DE",,5082,68492701,10500
"Fao Tanya Goodman, 11 Wards End, Halifax, HX1 1BX",01/04/2002,"11 Wards End, Halifax, HX1 1BX",Lifeline Project Ltd,1018.85,69264709,10250
,01/04/1990,"King Cross Working Mens Club, Warley Road, Halifax, HX1 3SU",,835.66,69276702,7400
,01/04/1994,"44a Hopwood Lane, Halifax, HX1 5ER",,3291.2,65364717,6800
"Units 2 & 6 , Emstead Works, Old Lane, Halifax, HX3 5QN",01/04/1990,"Units 2 & 6, Emstead Works, Old Lane, Halifax             HX3 5QN",Master Matting Co Ltd,5452.52,68132706,11750
"Oozewood Road, Royton, Oldham, OL2 5SQ",03/05/1993,"Unit 5/6, Margram Business Centre, Horne Street, Halifax             HX1 5UA",Thornham Paints [Yorks] Ltd,2894.44,65376706,9700
"Rates Administrator, Estates Management, Summit House, 27 Sale Place, London, W2 1YR",01/04/1996,"Advertising Right, S/O 68 Ovenden Road, Halifax, HX3 5PN",Jc Decaux Ltd,1984.4,68156712,4100
"Nndr Dept, Orion Gate, Guildford Road, Woking Surrey, GU22 7NJ",01/04/2000,"Board No 0335-01, 330 Ovenden Road, Halifax, HX3 5TJ",Clear Channel (Uk) Ltd,392.04,68156720,810
"Igueldo, Wade House Road, Shelf, Halifax, HX3 7PF",01/04/1990,"S/O 12 Shelf Moor Road, Shelf, Halifax, HX3 7PQ",Alfred Ashworth & Son (Landscapes) Ltd,0,68548700,1975
,18/05/1994,"440 Gibbet Street, Highroadwell, Halifax, HX2 0AU",,696.96,64820700,7200
"Rates Administrator, Estates Management, Summit House, 27 Sale Place, London, W2 1YR",01/04/1996,"Board Nos. 0065/0066/0115, Huddersfield Road, Halifax, HX3 0QA",Jc Decaux Ltd,4961,65412711,10250
,01/04/1995,"160 Park Dene, Hopwood Lane, Halifax, HX1 4DF",,0,68190160,1625
"Facilities Dept, 6 Great Marlborough Street, Manchester, M1 5SW",01/04/1990,"Ground Floor, 18 Silver Street, Halifax, HX1 1HS",Colonnade Insurance Brokers Ltd,4646.4,68580018,9600
,01/04/2000,"Moss Farm Nurseries, Keighley Road, Causeway Foot, Halifax             HX2 8XD",,636.48,65488701,2025
,01/09/1992,"Pharmacy & Chemist, 96 Free School Lane, Halifax, HX1 2YF",Heath Pharmacy Ltd,0,65108701,4700
"Fao Paul Ward Finance Manager, 3rd Floor, Westgate House, Halifax, HX1 1PS",01/04/1990,"Luddenden Youth Centre, Kershaw Drive, Luddendenfoot, Halifax             HX2 6PD",Calderdale Mbc Children & Young People's Services,3630,65508700,7500
,01/04/1990,"Security House, 248 Pellon Lane, Halifax, HX1 4PZ",,1539.75,68236729,8300
,30/06/1995,"Farrar Mill Yard, Farrar Mill Lane, Halifax, HX3 9EU",West End Joiners & Builders Ltd,765.57,65068700,7300
,29/09/2000,"Grd Flr Part Thornton Works, Fenton Road, Halifax, HX1 3PP",,0,65072707,5900
"Nndr Dept, Orion Gate, Guildford Road, Woking Surrey, GU22 7NJ",01/04/2000,"Board No 0702-0015, Pellon Lane, Halifax, HX1 5SP",Clear Channel (Uk) Ltd,116.16,68236742,240
"Unit 19a, Phoebe Lane Industrial Estate, Siddal, Halifax, HX3 9EX",01/04/1990,"Unit 22, North Phoebe Lane Ind Est, Halifax, HX3 9EX",Hawkhead Bray & Son Ltd,210.54,68248705,435
,01/04/1990,"64 Gibbet Street, Halifax, HX1 5BP",,5687,65164064,11750
,01/07/1997,"Adj 8 King Cross Street, Halifax, HX1 2SH",,0,65520710,10000
"Rates Administrator, Estates Management, Summit House, 27 Sale Place, London, W2 1YR",01/04/1996,"Adj 22 King Cross Street, Halifax, HX1 2SH",Jc Decaux Ltd,544.5,65520711,1125
,01/03/1999,"173b Spring Hall Lane, Halifax, HX1 4JG",T W Leach Ltd,262.16,68680715,6500
,01/07/2002,"119 Gibbet Street, Halifax, HX1 5BP",,0,65164119,2950
"Fao Shabbir Suleman, Westgate House, Westgate, Halifax, HX1 1PS",01/04/1990,"Southowram Branch Library, 14 Law Lane, Southowram, Halifax             HX3 9QU",Calderdale Mbc Leisure Services,1040.6,65592703,2150
,01/04/1990,"6 Powell Street, Halifax, HX1 1LN",,1132.67,68276006,7800
,01/04/1990,"61 Stainland Road, Greetland, Halifax, HX4 8BD",,1803.48,68772061,8600
,15/04/1998,"268 Gibbet Street, Halifax, HX1 4LT",,0,65164825,6000
"Unit 17, Lee Bridge Industrial Estate, Lee Bridge, Halifax, HX3 5HE",01/04/2000,"Unit 17, Lee Bridge Industrial Estate, Lee Bridge, Halifax             HX3 6RE",Hi-Tech Security And Fire Systems (Halifax) Ltd,907.5,65600721,7500
,05/08/1995,"Leeds Road, Halifax, HX3 7AE",,0,65612701,2125
,26/06/1999,"27/29 Stanningley Road, Mixenden, Halifax, HX2 8RJ",,0,68804029,3250
"Regen & Development, Northgate House, Northgate, Halifax, HX1 1UN",01/04/1990,"Opp Bridge Mill, Station Road, Luddendenfoot, Halifax              HX2 6AD",Calderdale Mbc,580.8,68824707,1200
,17/05/2001,"Stod Fold Boarding Kennels, Stod Fold Farm, Mixenden, Halifax             HX2 8XL",,0,68854700,4100
,28/02/1998,"64 Haley Hill, Halifax, HX3 6ED",,2236.5,65224714,4500
,03/08/1999,"5 Raven Street, Halifax, HX1 4NB",,0,68340005,5300
,01/04/1990,"Reservoir Road, Pellon, Halifax, HX2 0ET",,0,68368701,4850
,01/04/2002,"Units 1-4 The Shops, Whinney Hill Park, Brighouse, HD6 2NQ",,0,29640704,4300
"Units 11 & 12, Halifax Industrialcentre, Marshway, Halifax, HX1 5RW",04/10/2002,"Unit 8, Halifax Industrial Centre, Marshway, Halifax             HX1 5RW",Cts Ironmongery Ltd,3484.8,65752711,7200
"63 Ramsden Wood Road, Todmorden, OL14 7UD",01/04/1999,"Unit 1, Dancroft Industrial Units, Gauxholme Fold, Todmorden           OL14 7PW",Sweepwise Ltd,0,78176707,5900
,01/04/1990,"Star Garage, Townson Works, Hangingroyd Lane, Hebden Bridge       HX7 7DD",,4356,76244707,9000
"15 Savile Drive, Savile Park, Halifax, HX1 2EU",01/11/1999,"Unit 17, Mill House Works, Mill House Lane, Triangle            HX6 3LN",Mill House Furniture Makers Ltd,0,77352710,1350
,01/11/2001,"Unit 28A Mill House Works, Mill House Lane, Triangle, Sowerby Bridge       HX6 3LN",,0,77352737,1675
,01/04/2003,"25 Wharf Street, Sowerby Bridge, HX6 2LA",Freshfields Foods Ltd,564.68,77652025,7000
,04/04/2003,"Garage 1, Raglan Street, Todmorden, OL14 5HF",,0,78376700,1000
,01/04/1997,"Units 22 & 22a, Hebble End Mill, Hebble End, Hebden Bridge       HX7 6HJ",,0,76256726,2050
,01/06/1995,"Old Cawsey, Sowerby Bridge, HX6 2AJ",,2286.2,77404701,4600
,01/04/1994,"Opp Wood Mill, Halifax Road, Todmorden, OL14 6EE",,568.7,78192744,1175
,01/12/1995,"Part Ground Floor, Machpelah Works, Machpelah, Hebden Bridge       HX7 8AU",,221.17,76356704,2225
,13/10/1998,"5 King Street, Todmorden, OL14 5SL",,378.34,78260005,6700
"20 Lindrick Way, Bradshaw, Halifax, HX2 9QG",01/05/2003,"89 Turner Avenue South, Illingworth, Halifax, HX2 8EF",Trustees Of St. Mary's P.C.C.,0,69116089,2350
,01/04/1990,"New Oddfellows Hall, Oxford Street, Todmorden, OL14 5PU",,186.38,78348704,1875
,01/04/1990,"Unit 8a Washer Lane Works, Washer Lane, Halifax, HX2 7DX",,0,69296702,1750
,01/04/1990,"Midgley Road, Mytholmroyd, Hebden Bridge, HX7 5LR",,0,76372700,1650
"Regen & Development, Northgate House, Northgate, Halifax, HX1 1UN",01/04/1990,"New Road, Hebden Bridge, HX7 8AD",Calderdale Mbc,1064.8,76396707,2200
,01/04/1990,"Ivy Cottage, Norland, Sowerby Bridge, HX6 3RD",,0,77572700,1350
,12/03/2001,"Old Parcels Office, Todmorden Station, Rise Lane, Todmorden           OL14 7AA",,0,78396707,2500
,01/04/1990,"120 Rochdale Road, Todmorden, OL14 7NA",,0,78400120,1625
,02/03/1995,"1 West Avenue, Lightcliffe, Halifax, HX3 8TJ",,0,69336001,3900
,19/07/1999,"1 Baldwins Yard, Sowerby Bridge, HX6 2EQ",,0,77600701,2150
,01/04/1990,"276 Rochdale Road, Todmorden, OL14 7PD",,0,78400276,4000
"Calderbank Nurseries, Walsden, Todmorden, OL14 7TG",01/04/1990,"Bottoms Joinery Works, Rochdale Road, Todmorden, OL14 7UA",Gordon Rigg (Nurseries) Ltd,2274.8,78400712,4700
,01/04/1990,"773 Rochdale Road, Todmorden, OL14 6TG",,798.6,78400756,1650
,01/04/1990,"Back 32 Rochdale Road, Todmorden, OL14 7LD",,0,78400772,1800
,07/09/1998,"109a/111 Whitegate Road, Siddal, Halifax, HX3 9AW",,0,69432701,5300
,01/04/1990,"Whitehill Road, Illingworth, Halifax, HX2 9EU",,445.31,69448701,5600
,01/04/1993,"Gate Stoops Farm, Winterburn Road, Luddendenfoot, Halifax             HX2 6DA",,0,69485700,1725
"Regen & Development, Northgate House, Northgate, Halifax, HX1 1UN",01/04/1990,"Car Park, Bramsche Square, Todmorden, OL14 5AG",Calderdale Mbc,1887.6,78412700,3900
,01/04/1991,"Stansfield Hall, Stansfield Hall Road, Todmorden, OL14 5LR",,54.67,78440700,1375
,01/04/1995,"Rock End Moor Delph, Staups Lane, Todmorden, OL14 8RR",,0,78460701,1150
,01/09/1998,"26 Westgate, Halifax, HX1 1DJ",,5101.74,69400026,11500
,20/10/1995,"76 Wharf Street, Sowerby Bridge, HX6 2AF",,0,77652076,5700
"Nndr Dept, Orion Gate, Guildford Road, Woking Surrey, GU22 7NJ",01/04/2000,"Nr Roxy Bingo Hall, Wharf Street, Sowerby Bridge, HX6 2AE",Clear Channel (Uk) Ltd,232.32,77652706,480
,01/04/1990,"27 Water Street, Todmorden, OL14 5AB",,0,78508027,5600
,01/04/1990,"5 White Hart Fold, Todmorden, OL14 7BD",,0,78524701,5700
"C/O Capita Property &, Infrastructure Ltd, 65 Gresham Street, London, EC2V 7NQ",01/04/1990,"15a Woolshops, Halifax, HX1 1RU",Coal Pension Properties Ltd,3388,69536700,7000
"Lloyds Banking Group, C/O Cbre Corporate Outsourcing Ltd, 55 Temple Row, Birmingham, B2 5LS",16/03/1992,"17 Wharf Street, Sowerby Bridge, HX6 2LA",Halifax Plc,5445,77652732,11250
,08/10/1999,"Peakstones Farm, Soaper Lane, Shelf, Halifax              HX3 7PX",,0,79040700,950
"88 Old Street, London, EC1V 9HU",01/04/1990,"32 Bridge Gate, Hebden Bridge, HX7 8EX",Shelter National Campaign For Homeless People Ltd,1043.7,76060032,10500
"773 Rochdale Road, Walsden, Todmorden, Lancs, OL14 6TG",01/04/1990,"4 Brunswick Street, Todmorden, OL14 6TQ",J W Parker And Son Ltd,629.2,78072004,1300
"769 Rochdale Road, Todmorden, OL14 6TG",01/04/1990,"Brunswick Street, Todmorden, OL14 6TQ",Jack Parker,1621.4,78072700,3350
,01/04/1990,"15 Burnley Road, Todmorden, OL14 7BU",,0,78076015,6800
,01/04/1990,"S.B.I.C. Cricket Club, Blackwall Lane, Sowerby Bridge, HX6 2UB",,0,77068701,4350
,21/10/1996,"58 Burnley Road, Todmorden, OL14 5EY",,0,78076058,2800
,07/10/2002,"Constitutional Club, 6 Albert Street, Hebden Bridge, HX7 8AH",,0,76012712,5100
,01/04/1990,"26 Burnley Road, Mytholmroyd, Hebden Bridge, HX7 5LN",,0,76088026,1325
,30/09/1995,"1 Byron Avenue, Sowerby Bridge, HX6 2HF",,544.5,77120001,1125
,08/09/2002,"Unit 2A, Canteen Mill Ind. Units, Burnley Road, Todmorden           OL14 7DR",,152.46,78076742,6300
,01/04/1990,"Triangle Cricket Club, Grassy Bottoms, Stansfield Mill Lane, Triangle",,0,77228700,5600
,01/04/1990,"33 Crown Street, Hebden Bridge, HX7 8EH",,262.16,76176033,6500
"Crown Works, Victoria Road, Hebden Bridge, HX7 8JX",01/04/1990,"Adj Crown Works, Foster Lane, Hebden Bridge, HX7 8JX",Victoria Road Garage (Hebden Bridge) Ltd,980.1,76212701,2025
,01/04/1990,"Hollins Mill Lane, Sowerby Bridge, HX6 2QG",,4743.2,77276702,9800
"C/O Mrs Jane Clay, Birkby Lane, Baliff Bridge, Brighouse, HD6 4EW",01/01/2005,"Birkby Lane, Bailiff Bridge, Brighouse, HD6 4EW",The Clifton & Lightcliffe Subscription Band Association,221.17,29084704,2225
,10/11/2003,"76 Saddleworth Road, Greetland, Halifax, HX4 8AG",,0,68444076,2900
"Office Suite E345, Dean Clough, Halifax, HX3 5AX",01/04/2004,"Unit L3, L Block, Dean Clough Office Park, Halifax              HX3 5AX",Dean Clough Ltd,0,64784867,800
,01/06/2005,"Unit 4 The Ainleys, Huddersfield Road, Elland, HX5 9JP",,0,56132740,2325
,20/11/2005,"2/2a Towngate, Southowram, Halifax, HX3 9QZ",,2081.99,69088004,8900
,01/04/2005,"17 West End, Hebden Bridge, HX7 8UQ",,0,76576017,5000
"Finance Section, Bull Green House, Bull Green, Halifax, HX1 2EB",01/04/2005,"Highmoor Community Centre, 2 Highmoor Crescent, Clifton, Brighouse            HD6 4HZ",Pennine Housing 2000 Ltd,895.4,29336004,1850
"C/O Mr E R Collinge, Wesley Villa, New Road , Luddenden, Halifax, HX2 6QZ",01/04/2003,"Luddenden Lane, Luddendenfoot, Halifax, HX2 6NH",Luddenden Conservation Society,0,65716702,1800
,01/04/2005,"Mill Lane, Boothtown, Halifax, HX3 6TR",,49.22,65808708,6100
,01/09/2005,"17 King Cross Street, Halifax, HX1 2SH",,629.96,65520728,7100
,21/11/2005,"200 King Cross Road, Halifax, HX1 3JP",,438.82,65516200,6800
"Ossett Brewery, Kings Yards, Low Mill Road, Osset, WF5 8ND",28/11/2005,"Travellers Inn, Tanhouse Hill, Hipperholme, Halifax             HX3 8HN",Ossett Brewery Pub Co Ltd,1669.8,69004701,3450
,12/08/2003,"13 Lane Ends Green, Hipperholme, Halifax, HX3 8EZ",,0,65576013,3800
"2 Turner Avenue South, Illingworth, Halifax, HX2 8EH",01/04/2005,"14 Bank Edge Road, Halifax, HX2 8JU",S.N.J Mini Market Ltd,0,64136014,1800
,28/02/2005,"574 Rochdale Road, Todmorden, OL14 7SL",,0,78400574,2800
,25/02/2005,"Unit 9A, Top Land Country Busn.Pk, Cragg Road, Mytholmroyd          HX7 5RU",,0,76160734,4050
,01/05/2003,"1 High Street, Brighouse, HD6 1DE",,2565.2,29324001,5300
"Savile Road, Dewsbury, WF12 9LN",26/01/2004,"25 Huddersfield Road, Brighouse, HD6 3RQ",Calder Vets Ltd,4017.2,29344701,8300
,03/09/2004,"Unit 2, Westbury Street, Elland, HX5 9AT",Control House Ltd,5082,56248713,10500
,01/12/2004,"Unit 3A, Topland Country Busn.Pk., Cragg Road, Mytholmroyd          HX7 5RU",Expertreat Ltd,378.34,76160744,6700
"Geddes Street Warehouse, Off Preston Old Road, Cherry Tree, Blackburn, BB2 5LQ",08/12/2003,"Market Stall 24, Market Hall, Borough Market, Halifax             HX1 1DZ",Edges Ltd,1355.2,64288720,2800
,17/06/2003,"18 Lightcliffe Road, Brighouse, HD6 2DR",,0,29384018,4000
"Unit 9 Westpoint Enterprise Pk, Clarence Avenue, Trafford Park, Manchester, M17 1QS",01/09/2003,"Advertising Right, Springs Service Station, Halifax Road, Todmorden           OL14 5TS",Primesight Ltd,232.32,78192792,480
"Attn Wendy Backhouse, Building Cleaning Servces, Northgate House, Northgate, Halifax, HX1 1UN",01/04/2003,"Public Convenience, New Road, Hebden Bridge, HX7 8AD",Calderdale Mbc,1500.4,76396727,3100
"Attn Wendy Backhouse, Building Cleaning Servces, Northgate House, Northgate, Halifax, HX1 1UN",01/04/2003,"Public Convenience, Valley Road, Hebden Bridge, HX7 7BZ",Calderdale Mbc,1573,76552743,3250
,24/05/2003,"12 Bridge End, Brighouse, HD6 3DH",,0,29092012,2375
,01/04/2005,"Unit R8, Tenterfields Business Park, Luddendenfoot, Halifax             HX2 6EQ",,0,64448785,2850
"322/326 Ovenden Road, Halifax, HX3 5TJ",01/04/2003,"322/326 Ovenden Road, Halifax, HX3 5TJ",Noah's Ark Community Cafe,0,65625701,4850
,01/06/2004,"Unit 70 Bowers Mill, Branch Road, Barkisland, Halifax              HX4 0AD",Wright Angle Marketing Ltd,0,64344734,4950
"Land And Property Services, Northgate House, Northgate, Halifax, HX1 1UN",01/04/2003,"36 The Colonnade, Piece Hall, Halifax, HX1 1RE",Calderdale Mbc,0,68252748,2500
,07/01/2005,"688 Burnley Road, Todmorden, OL14 8JU",,0,78076688,770
,28/11/2003,"23 Hud Hill, Northowram, Halifax, HX3 7LH",,0,65909023,650
"19 Mayfield Grove, Bailiff Bridge, Brighouse, HD6 4EE",08/11/2004,"First Floor Unit 7A, Woodman Works, South Lane, Elland               HX5 0PA",Woodman Architectural Fittings Ltd,0,56220773,1175
,01/04/2003,"Balcony Store 13, Borough Market, Halifax, HX1 1DZ",,104.06,64288785,215
,01/04/2004,"Balcony Store 7, Borough Market, Halifax, HX1 1DZ",,73.57,64288779,152
,30/10/2004,"13 St Georges Square, Hebden Bridge, HX7 8ET",,0,76508013,11750
"Atlas Works, Sedburgh Road, Halifax, HX3 9HB",01/06/2003,"Sedburgh Road, Halifax, HX3 9HB",Kirklees Stone Merchants Ltd,4452.8,68520702,9200
"Unit 9 Westpoint Enterprise Pk, Clarence Avenue, Trafford Park, Manchester, M17 1QS",01/04/2005,"Adv Rt Victoria Rd Serv Stn, Victoria Road, Elland, HX5 0PU",Primesight Ltd,232.32,56244716,480
,31/08/2003,"2 Park Lane, Siddal, Halifax, HX3 9ED",,0,68196002,4850
,01/06/2002,"Basement, 10A Akroyd Place, Halifax, HX1 1YH",,0,64036010,920
,14/06/2003,"Boothwood Boarding Kennels, Oldham Road, Rishworth, HX6 4RH",,0,77412700,3550
,17/09/2003,"Spring Gardens Inn, 45 Elland Lane, Elland, HX5 9EP",,206.52,56084718,6400
"Montagu Evans Llp, 2nd Floor, Abbey House, 74 Mosley Street, Manchester, M2 3LW",01/07/2001,"Workshop, Sod House Green, Halifax, HX3 6QR",Ladbrokes Betting & Gaming Ltd,1306.8,68620708,2700
,01/04/2004,"Dove Cottage Nursery, 23 Shibden Hall Road, Halifax, HX3 9XA",,0,68556023,840
,04/09/2004,"The Clubhouse, Warley Town Lane, Halifax, HX2 7SL",Halifax Vandals R.U.F.C,1093.4,69284701,11000
"Northgate House, Northgate, Halifax, HX1 1UN",01/09/2005,"Carlton Street, Halifax, HX1 2AF",Calderdale Mbc Land & Property Services,0,65276700,2950
,31/08/2005,"24 Water Street, Todmorden, OL14 5AB",,0,78508024,2025
"Part 1st Floor, Ies House, Mission Street, Brighouse, HD6 1NQ",01/08/2004,"Part First Floor, I E S House, Mission Street, Brighouse            HD6 1NQ",I.E.S Group Ltd,4961,29428701,10250
,02/11/2004,"184 King Cross Road, Halifax, HX1 3LN",,0,65516184,3900
,01/09/2005,"Unit 26, Phoebe Lane Industrial Est., Halifax, HX3 9EX",,0,68248715,950
"P O Box 6079, Wolverhampton, WV1 9RA",01/04/2003,"Site No. W Y 0 049, Adj Silverwood, Moorbottom Lane, Greetland            HX4 8PZ",Airwave Solutions Ltd,2855.6,65906701,5900
,01/06/2004,"9 West End, Hebden Bridge, HX7 8JP",,0,76576009,3350
,20/10/2003,"Market Stall 126, Market Hall, Borough Market, Halifax             HX1 1DZ",,0,64288766,2700
,01/04/2004,"18 Corporation Street, Sowerby Bridge, HX6 2QQ",,0,77160018,1975
