Billing Address,Liability Start Date,Property Address,Ratepayer,Net Debit,Property Reference,RV
"Unit 21, The Coach House, 11 Owler Ings Road, Brighouse, HD6 1EJ",01/05/2014,"Office 21, 11 Owler Ings Road, Brighouse, HD6 1EJ",First Co Solutions Ltd,0,29452746,2000
"10a Queen Street, Godalming, Surrey, GU7 1BD",01/01/2015,"Unit 1 Victoria Works, The Boathouse, Wharf Street, Brighouse            HD6 1PP",Appetite 4 Recruitment Ltd,1573,29636715,3250
,01/12/2013,"Unit 1, 2 Silver Street, Halifax, HX1 1HS",,0,68580727,5900
"Office H M 2.0, Holmfield Mills, Holdsworth Road, Halifax, HX3 6SN",01/01/2014,"Unit 1.02/1.03, White Rose Mill, Holdsworth Road, Halifax              HX3 6SN",Kino & Co,0,65344982,1600
,31/05/2012,"2 Warley Grove, Halifax, HX2 0AE",,0,69268701,1650
,30/07/2014,"14 Victoria Road, Elland, HX5 0PU",,0,56244014,3000
"Watson Quarry, Brookfoot Lane, Halifax, HX3 6SZ",01/06/2014,"Fossil Stone, Brookfoot Lane, Brighouse, HD6 2RA",Associated Stone Masonry Ltd,2710.4,29112715,5600
"C/O Begbies Traynor, 9th Floor, Bond Court, Leeds, LS1 2JZ",01/04/2014,"Office 8, James Street Mills, South Lane, Elland               HX5 0HB",Heritage Lofts Ltd (In Administration),0,56220791,1500
"7 Cottage Road, Headingley, Leeds, LS6 4DD",10/01/2015,"Suite 2A First Floor, Fountain Chambers, Fountain Street, Halifax              HX1 1LW",A T C Properties Ltd,0,65100715,1200
,01/06/2014,"Over 2 Waterhouse Street, Halifax, HX1 1JA",,0,69304709,1950
"Warmco Industrial Park, Manchester Road, Mossley, Ashton Under Lyne, OL5 9AY",01/01/2013,"Unit 307 3RD Flr South Side, Exchange Mill, Saddleworth Road, Elland               HX5 0RY",Warmco Space Heating Ltd,0,56212747,1000
,06/05/2014,"Ground Floor, 58/60 Southgate, Elland, HX5 0DQ",,907.5,56224752,7500
"Attn Barbara Harbinson, The Elsie Whiteley Centre, Hopwood Lane, Halifax, HX1 5ER",01/07/2014,"Childrens Centre, Mount Pellon Primary Academy, Battinson Road, Halifax              HX1 4RG",Halifax Opportunities Trust,64.61,64176719,6500
"196 Rochdale Road, Todmorden, Lancashire, OL14 7NA",20/05/2014,"196 Rochdale Road, Todmorden, OL14 7NA",Freestyle Display Ltd,0,78400749,3050
"Bridge Mill, St George's Square, Hebden Bridge, HX7 8ET",01/05/2014,"Unit 21b, Hebble End, Hebden Bridge, HX7 6HJ",Millcraft Associates,0,76256732,1150
"36 Shoreham Rise, Two Mile Ash, Milton Keynes, MK8 8BS",21/07/2014,"Office B20 First Floor, Croft Myl, West Parade, Halifax              HX1 2EQ",Infoobjects Ltd,0,69360735,2400
,26/09/2013,"Unit 20 Bowers Mill, Branch Road, Barkisland, Halifax             HX4 0AD",,0,64344709,3050
"Bridge Mill, St Georges Square, Hebden Bridge, HX7 8ET",01/11/2011,"Unit 8 Bridge Mill, St Georges Square, Hebden Bridge, HX7 8ET",Sharlketh Ltd,0,76508723,530
"Warmco Industrial Park, Manchester Road, Mossley, Ashton Under Lyne, OL5 9AY",01/04/2014,"Unit 3B Wilkin Royd Mills, Mill Lane, Brighouse, HD6 1PN",Warmco Space Heating Ltd,0,29420745,2500
,01/04/2014,"Office 7, 11 Owler Ings Road, Brighouse, HD6 1EJ",,0,29452724,860
,01/12/2014,"65/67 Southgate, Elland, HX5 0DQ",,0,56224722,6000
,20/05/2011,"35 Victoria Road, Elland, HX5 0AB",,0,56244035,2500
,01/01/2014,"Unit 19 Middle Floor, Old Fire Station, Rochdale Road, Todmorden           OL14 7NA",Firedragon Games Llp,0,78400863,1450
,01/10/2014,"265 Queens Road, Halifax, HX1 4NS",,0,68308265,5100
"Integra, St Asaph Business Park, St Asaph, Denbighshire, LL17 0JD",01/10/2014,"Unit 1 Grd Floor North Side, Exchange Mill, Saddleworth Road, Elland               HX5 0RY",Greenthumb Ltd,1524.6,56212750,3150
,01/03/2015,"Unit 1B South Mill, White Rose Mill, Holdsworth Road, Halifax              HX3 6SN",,0,65344919,2000
,13/08/2014,"173 Queens Road, Halifax, HX1 4LN",,0,68308173,2425
"Pennine House, Zebra Court, White Moss View, Manchester, M24 1UN",02/01/2015,"Office 14 Ground Floor, The E W Innovation Centre, Hopwood Lane, Halifax              HX1 5ER",We Buy Any Car Ltd,2613.6,64242712,5400
,23/06/2014,"Unit 6, Hansonlane Enterprise Centre, Hanson Lane, Halifax             HX1 5PG",,0,65264731,2000
,05/03/2015,"5 Market Street, Hebden Bridge, HX7 6EU",,0,76360005,6200
,14/01/2013,"Market Stall 110-111, Market Hall, Borough Market, Halifax              HX1 1DZ",,0,64288819,4000
,01/04/2014,"3 Ovenden Road, Halifax, HX3 5PN",,0,68156003,4050
"And  District Branch, The Rspca Animal Shelter, Wade Street, Halifax, HX1 1SN",08/12/2014,"19 Southgate, Elland, HX5 0BW","R.S.P.C.A. Halifax, Huddersfield",0,56224019,4950
"Leonard Curtis, Business Rescue & Recovery, 5 Albion Court, Leeds, LS1 6JL",28/09/2014,"First And Second Floors, Unit 1b Dunkirk Mills, Dunkirk Lane, Halifax             HX1 3TA",Ppc Uk Ltd (In Administration),0,64852706,2175
"Leonard Curtis, Business Rescue & Recovery, 5 Albion Court, Leeds, LS1 6JL",27/09/2014,"Basement, 1B Dunkirk Mills, Dunkirk Lane, Halifax              HX1 3TA",Ppc Uk Ltd (In Administration),0,64852703,2075
,19/02/2015,"20A/20B Town Hall Street, Sowerby Bridge, HX6 2EA",Dogan Limited,696.96,77600724,7200
,05/10/2014,"Unit 14C, Asquith Bottom Works, Ridge Street, Sowerby Bridge       HX6 3BS",,0,77024714,2150
,01/11/2012,"1a St James Street, Halifax, HX1 5SU",,0,68736701,1825
"C/O Mr S Green, 45 Upper Lane, Northowram, Halifax, HX3 7EE",16/04/2014,"Land Rear Wkw Engineering, Atlas Works, Sedburgh Road, Halifax              HX3 9HB",W.K.W. Precision Engineering Co Ltd,871.2,68520717,1800
,01/10/2014,"Unit 4, Salford Industrial Estate, Salford, Todmorden           OL14 5BT",,0,78408783,2900
,07/12/2014,"Oldham Road, Ripponden, Sowerby Bridge, HX6 4EB",,2081.99,77408713,8900
,13/10/2014,"Units 5/6 Station Ind.Park, Station Road, Luddendenfoot, Halifax              HX2 6AD",,0,68824720,5600
,17/08/2012,"1 Ryders Court, Denholmegate Road, Hipperholme, Halifax             HX3 8JQ",,0,68378001,2650
"Rose House, 293 Rise Lane, Todmorden, OL14 7AA",01/12/2013,"Rise Lane, Todmorden, OL14 7AA",Natural Endings Ltd,0,78396700,3750
,01/10/2014,"10 Wards End, Halifax, HX1 1BX",,3115.5,69264708,9900
,01/08/2014,"Beech House Self Catering, Palace House Road, Hebden Bridge, HX7 6HW",,0,76424703,1750
,01/01/2015,"Office First Floor, 161A King Cross Road, Halifax, HX1 3LN",,0,65516786,1750
"2 King Street, Halifax, HX1 1SR",31/03/2015,"10 Blackwall, Halifax, HX1 2BE",Hird & Partners L L P,5839.75,64268010,11750
"And  District Branch, The Rspca Animal Shelter, Wade Street, Halifax, HX1 1SN",18/01/2013,"1ST Flr Rear, Queens Hall, Queens Road, Halifax              HX1 3NS","R.S.P.C.A. Halifax, Huddersfield",19.38,68308839,1950
,01/04/2014,"11 Town Hall Buildings, Elland, HX5 0EU",,0,56236011,5700
"Suite 655 Mk Business Centre, Foxhunter Drive, Linford Wood, Milton Keynes, MK14 6GD",31/03/2015,"Electronic Delivery Locker, King Cross Street, Halifax, HX1 2SH",Inpost Uk Ltd,459.8,65520739,950
"Ainleys Industrial Estate, Huddersfield Road, Elland, HX5 9JP",01/07/2013,"Offices 6-8, Calder Street, West Vale, Halifax              HX4 8AQ",Drive Medical Ltd,3533.2,64480717,7300
,01/05/2015,"Unit 7 Windsor Works, Victoria Road, Hebden Bridge, HX7 8JX",,0,76560724,3450
,31/05/2015,"36 Lister Lane, Halifax, HX1 5AX",,4075.4,65652731,8200
"C/O Throstle Nest, Warley Wood Lane, Luddendenfoot, Halifax, HX2 6BW",26/02/2014,"Calder Street, West Vale, Halifax, HX4 8AQ",B W Sipp Trustees Limited,0,64480701,1550
,20/07/2015,"Windmill Tavern, Park Square, Hough, Northowram           HX3 7BZ",,4763.78,68212700,11250
"F.A.O. Samantha Jane Lee, Martha's Ale House, Well Lane, Guiseley, LS20 9BA",01/04/2015,"Punch Bowl Inn, 389 Huddersfield Road, Halifax, HX3 9LJ",Leodis Properties Ltd,2360.75,65412706,4750
,01/05/2015,"47 Wharf Street, Sowerby Bridge, HX6 2LB",,0,77652047,2800
,28/02/2015,"Unit 34 2ND Floor, The Town Hall, St George's Street, Hebden Bridge        HX7 7BY",,0,76500752,1625
"St Aidans Chapel, Bradford Road, Bailiff Bridge, Brighouse, HD6 4EA",08/12/2014,"Unit 22, Branxholme Industrial Est., Bradford Road, Brighouse            HD6 4EA",Oiltech Europe Ltd,4065.6,29084720,8400
"Aspen House, Wykeham Road, North Minster Business Park, York, YO26 6QW",01/04/2015,"Sales Office Apt 2 Gf, Leedham Court, Victoria Road, Hebden Bridge        HX7 8DZ",McCarthy & Stone Retirement Lifestyles Ltd,3242.8,76560743,6700
"Office Suite E207, Dean Clough Mills, Halifax, HX3 5AX",01/05/2015,"Office Suite E207, Dean Clough Mills, Halifax, HX3 5AX",Ground Strategies Ltd,696.96,64296732,7200
"33 Corsham Street, London, N1 6DR",01/01/2014,"Unit 9 1ST Floor, The Town Hall, St George's Street, Hebden Bridge        HX7 7BY",Locality (Uk),94.43,76500713,950
,01/10/2014,"Unit B 2ND Floor, Asquith Bottom Mills, Asquith Bottom, Sowerby Bridge       HX6 3BS",,0,77024789,810
,01/04/2014,"Unit 3, George Street, Elland, HX5 0NE",,0,56108707,3250
"C/O G L Hearn Management Ltd, Po Box 1610, Southampton, SO15 3WX",20/08/2014,"Atm At Tesco Express, Free School Lane, Halifax, HX3 0AA",Tesco Personal Finance Ltd,4017.2,65108717,8300
"William Street, Brighouse, HD6 1HR",14/02/2015,"Ground Floor Office, Cellar 28, William Street, Brighouse            HD6 1HR",Cellar 28 Ltd,0,29644028,1200
,01/03/2015,"45 Borough Market, Halifax, HX1 1DY",,0,64288045,2350
,01/01/2014,"Unit D Eastfield Mills, Belmont Street, Halifax, HX3 6AT",,0,64236729,3400
,01/01/2014,"Unit F Eastfield Mills, Belmont Street, Halifax, HX3 6AT",,1987.51,64236730,8800
"Business Rates Payment Mgr., Lambert Smith Hamptob, 2nd Floor, 41-51 Grey Street, Newcastle Upon Tyne, NE1 6EE",23/01/2015,"1ST Floor, 2 William Street, Brighouse, HD6 1HR",Rathbone Training Ltd,516.88,29644704,5200
"3a Romsey Close, Lindley, Huddersfield, HD3 3GU",11/07/2014,"Grove Garage, James Street, Elland, HX5 0HB",I Haigh Forklift Solutions Ltd,0,56144719,990
,01/06/2015,"623 Bradford Road, Bailiff Bridge, Brighouse, HD6 4DN",,0,29084623,3400
,05/07/2015,"Unit 18 2ND Floor, The Town Hall, St George's Street, Hebden Bridge        HX7 7BY",Millstone Grit Productions Ltd,0,76500729,1675
,11/08/2015,"2 Martin House, Martin Street, Brighouse, HD6 1DA",Project 1 Architectural Designs Ltd,0,29408700,1550
,02/06/2015,"Brooke House, 7 Brooke Green, Hipperholme, Halifax             HX3 8ES",Accurating Ltd,0,64404700,2250
"8 Greenacres, Shelf, Halifax, HX3 7QT",27/07/2015,"Bbw Business Centre 2ND Flr, 12 Wade House Road, Shelf, Halifax              HX3 7PB",Yorkshire Tutoring Limited,0,69216727,1550
,24/07/2015,"20 Silver Street, Halifax, HX1 1HS",,4452.8,68580020,9200
,21/07/2015,"Junction Inn, 1 Ogden Lane, Brighouse, HD6 3HF",Stanford Leisure Ltd,3097.6,29444702,6400
,01/05/2015,"Front Land Old Watson Bakery, Adelaide Street, Halifax, HX1 4LY",,2855.6,64024714,5900
,01/06/2015,"Unit 1 Queens Road Works, Queens Road, Halifax, HX1 3XY",,0,68308829,4250
"Hazeldean, Station Road, Leatherhead, Surrey, KT22 7AA",01/04/2015,"Ind Dist Network Operator, Blackley Road, Elland, HX5 0TB",Esp Electricity Ltd,26.14,56016705,54
,26/05/2015,"Suite E 1ST Floor, Clifton Mills, Bradford Road, Brighouse            HD6 4EJ",Epic Asbestos Solutions Ltd,3484.8,29084849,7200
"Suite F 1st Floor, Clifton Mills, Bradford Road, Brighouse, HD6 4EJ",16/10/2015,"Suite F 1ST Floor, Clifton Mills, Bradford Road, Brighouse            HD6 4EJ",Energy Unique Ltd,0,29084850,4650
,01/10/2015,"53 Crown Street, Halifax, HX1 1JB",,3429.3,64756740,6900
,01/12/2015,"Office 9 Ground Floor, The E W Innovation Centre, Hopwood Lane, Halifax              HX1 5ER",Uber Britannia Ltd,919.6,64242707,1900
"Office H M 2.0, Holmfield Mills, Holdsworth Road, Halifax, HX3 6SN",01/09/2015,"Unit Hm 1.04, Holmfield Mills, Holdsworth Road, Halifax              HX3 6SW",Kino & Co,0,65344501,1125
,11/12/2015,"43/45 Bridge End, Brighouse, HD6 3DN",,2211.65,29092709,4450
,23/05/2000,"The Mushroom, Gooder Street, Brighouse, HD6 1AT",,0,29272707,1950
"Unit 1, Fordsall House, Huddersfield Road, Elland, HX5 9DW",01/10/1997,"Unit 1, Fordsall House, Huddersfield Road, Elland              HX5 9DW",Elland Tyre & Exhaust Services Ltd,629.96,56132744,7100
,19/05/1995,"Balcony Store 24, Borough Market, Halifax, HX1 1DZ",,147.62,64288795,305
"Fao Rates Management, Lambert Smith Hampton, Interchange Place, Edmund Street, Birmingham, B3 2TA",07/12/1994,"Car Park, Rear Bowling Mill, Dean Clough Mills, Halifax, HX3 5AX",Royal & Sun Alliance,4114,64784704,8500
,01/04/1990,"Unit D31, D Mill, Dean Clough Industrial Park, Halifax              HX3 5AX",,0,64784745,2850
"Fao Shabbir Suleman, Westgate House, Westgate, Halifax, HX1 1PS",01/04/1990,"Bailiff Bridge Library, Devon Way, Bailiff Bridge, Brighouse           HD6 4DT",Calderdale Mbc Leisure Services,2565.2,29224700,5300
,01/04/1990,"Cromwell Lake, Elland Road, Brighouse, HD6 2RG",,1210.78,29236705,7900
,01/04/1991,"Unit GY/1, G Mill Yard, Dean Clough Industrial Park, Halifax              HX3 5AX",,0,64784780,3750
,01/05/1998,"415 Halifax Road, Brighouse, HD6 2PD",Randal & Co Accountants Ltd,0,29296415,4550
"94 Commercial Street, Brighouse, HD6 1AQ",01/04/1990,"5 Heaton Street, Brighouse, HD6 1HG",Websters (Brighouse) Ltd,3146,29316005,6500
,01/04/1990,"Between 1 & 3 Hey Street, Brighouse, HD6 4AT",,324.28,29320700,670
,01/04/1999,"6 Huddersfield Road, Brighouse, HD6 1JZ",,5445,29344006,11250
"Regen & Development, Northgate House, Northgate, Halifax, HX1 1UN",01/04/1990,"S/O 9 Northgate, Elland, HX5 0RU",Calderdale Mbc,532.4,56180703,1100
,01/04/1990,"Southedge Iron Works, Brighouse Road, Hipperholme, Halifax             HX3 8EG",,0,64376711,5300
"Rates Administrator, Estates Management, Summit House, 27 Sale Place, London, W2 1YR",01/04/1996,"Site No BH3 (El Sub Sta), Opp 17 Huddersfield Road, Brighouse, HD6 1JZ",Jc Decaux Ltd,762.3,29344720,1575
,01/04/1990,"7 Rochester Place, Savile Road, Elland, HX5 0LB",,0,56204007,2500
,01/04/1990,"Calder Bank Mills, Saddleworth Road, Elland, HX5 0RY",Newsome Ltd,2577.67,56212706,9400
,01/04/1994,"15 Lightcliffe Road, Brighouse, HD6 2DR",,0,29384015,4150
,04/08/1990,"Lightcliffe Road, Brighouse, HD6 2DJ",,0,29384704,4300
,16/04/2001,"54B Southgate, Elland, HX5 0DQ",Ciella Ltd,0,56224054,4100
,01/04/1990,"Owler Ings Road, Brighouse, HD6 1EJ",,0,29452704,5500
"26 Northgate, Elland, West Yorks, HX5 0RU",01/04/1990,"70 Southgate, Elland, HX5 0PS",Joseph Dobson & Sons Ltd,2710.4,56224070,5600
,01/04/1990,"Adj 8 Austin Avenue, Brighouse, HD6 2EY",,0,29036700,2350
,01/04/1997,"Unit 3, 42 Park Street, Brighouse, HD6 1JL",,5452.52,29460707,11750
,09/02/2001,"3/4 Town Hall Buildings, Elland, HX5 9AJ",,206.52,56236003,6400
,01/04/1990,"1a Birds Royd Lane, Brighouse, HD6 1LQ",R H & G Travis & Sons Ltd,0,29052713,5000
"C/O Ctil, Rate A/C Management, Colliers Int Rating Uk Llp, 12th Floor, 11 Brindley Place, 2 Brunswick Square, Brindley Place, Birmingham, B1 2LP",01/01/1998,"Telecommunications Mast, Site Ref  3661, Brighouse, HD6 1SP",Vodafone Ltd,2565.2,29064705,5300
,04/05/1996,"Smith House Avenue, Brighouse, HD6 2JZ",,3812.47,29520700,10500
,01/04/1990,"Akroyd House, 2 Akroyd Place, Halifax, HX1 1YH",Aarondale Accountancy Services Ltd,564.68,64036700,7000
,01/04/1990,"Birds Royd Lane, Brighouse, HD6 1LQ",Bsmw Products Ltd,5324,29052704,11000
,01/04/1998,"Over4-10 Albion Street, Halifax, HX1 1DU",,1258.4,64052703,6500
,01/04/1990,"Chapel Lane, Salterhebble, Halifax, HX3 0QN",Pearson Brothers (Engravers) Ltd,1210.78,64532700,7900
"Fao Paul Ward Finance Manager, 3rd Floor, Westgate House, Halifax, HX1 1PS",01/04/1990,"R/0 62 Chevinedge Crescent, Halifax, HX3 9EQ",Calderdale Mbc Children & Young People's Services,955.9,64560700,1975
,01/04/1990,"36 Bradford Road, Brighouse, HD6 1RW",,1895.07,29080036,8700
,01/04/1990,"Bowling Club, Amisfield Road, Hipperholme, Halifax             HX3 8NE",,0,64072703,4650
,20/11/1995,"99a Ovenden Road, Ovenden, Halifax, HX3 5RQ",,0,64096701,2475
,01/04/2001,"Unit 1, Wood Street, Brighouse, HD6 1PW",,0,29648700,7000
,09/04/1998,"11 Briggate, Elland, HX5 9HG",,1936,56020011,4000
,28/10/1991,"16 Bank Edge Road, Halifax, HX2 8JU",,0,64136016,2350
,01/04/1990,"Part Ground Floor, 38 Clare Road, Halifax, HX1 2HX",,762.3,64584714,1575
,28/03/1999,"143 Claremount Road, Halifax, HX3 6JQ",,0,64592143,3500
,01/04/1997,"1st Floor Wellington House, Briggate, Brighouse, HD6 1DN",League Publications Ltd,3513.48,29100709,10250
,01/04/1990,"Bute Avenue, Brighouse, HD6 2JA",,51.37,29120700,1375
,01/04/1990,"Model Railway Club, Cawcliffe Road, Brighouse, HD6 2HP",,0,29144700,1575
"Miall Works, Battinson Road, Halifax, HX1 4AZ",15/04/1991,"Miall Works, Battinson Road, Halifax, HX1 4AZ",Simms Electrical Distributors Ltd,3484.8,64176705,7200
,01/04/1999,"Belmont Street, Claremount, Halifax, HX3 6AT",,304.92,64236700,630
"Unit 5 Grantham Works, Grantham Road, Halifax, HX3 6PL",15/04/1994,"Thrum Hall Works, Clay Pits Lane, Halifax, HX1 4QS",Calderdale Engineering Services Ltd,1803.48,64600700,8600
"Kenann House, 32 Newby Road Industrial Est, Hazel Grove, Stockport, SK7 5DA",07/09/1995,"Bath Place, R/O11-19 Bramston Street, Brighouse, HD6 3AA",Fit-Lock Systems Ltd,0,29088707,2475
,01/07/1996,"79 Elizabeth Street, Elland, HX5 0JH",D D Goody Ltd,0,56076079,3850
,01/04/1990,"Rastrick Cricket Club, Clough Lane, Rastrick, Brighouse           HD6 3QL",,874.72,29184700,8800
,24/03/2001,"49 Commercial Street, Halifax, HX1 1BE",,0,64660049,6000
,13/10/1993,"110 Commercial Street, Brighouse, HD6 1AQ",,1132.67,29196110,7800
,06/12/1990,"128 Crowtrees Lane, Brighouse, HD6 3NH",,0,29200128,2950
,06/04/1999,"Spata Ironworks, Halifax Road, Elland, HX5 0SH",,0,56116711,1650
,01/05/1997,"Cartwheel Club, Huddersfield Road, Elland, HX5 9DW",,0,56132721,5700
,01/07/1996,"Market Stall 29-32, Market Hall, Borough Market, Halifax             HX1 1DZ",,3513.48,64288723,10250
,01/04/1996,"Corporal Lane Quarry, Corporal Lane, Halifax, HX3 7TG",,266.2,64690700,550
,01/04/1990,"Cross Roads, Wainstalls, Halifax, HX2 7TE",,0,64724700,1475
"Finance Section, Bull Green House, Bull Green, Halifax, HX1 2EB",02/10/2001,"77 Turner Avenue South, Illingworth, Halifax, HX2 8EF",Pennine Housing 2000 Ltd,1137.4,69116077,2350
"C/O Pure Rate Savers Ltd, 5 Diamond Court, Kingston Park, Newcastle Upon Tyne, NE3 2EN",27/05/2000,"4 Milner Street, Halifax, HX1 5NU",Magic Carpets (Halifax) Ltd,3003.92,65816004,9800
,01/04/1997,"15 Roils Head Road, Halifax, HX2 0NQ",,0,68396015,1500
,01/04/1990,"The Ramsdens, Upper Kingston, Hopwood Lane, Halifax              HX1 4HA",,1626.24,69164700,8400
,17/11/2001,"Little London Farm, Upper Lane, Northowram, Halifax             HX3 7ST",,0,69170700,1600
,08/09/1997,"N'Owram Childrens Riding Sch, Upper Lane, Northowram, Halifax             HX3 7EE",,0,69170702,2200
,01/04/1990,"Hanover House, Pye Nest Road, Halifax, HX2 7HE",Hanover Housing Association,178.92,65260700,1800
,01/04/1990,"25 Hanson Lane, Halifax, HX1 5NX",,750.2,65264025,1550
,01/05/1992,"51 Hanson Lane, Halifax, HX1 5NX",Living Care Pharmacy Ltd,1089,65264051,2250
"Fao Paul Ward Finance Manager, 3rd Floor, Westgate House, Halifax, HX1 1PS",01/04/1990,"Ling Bob, Rye Lane, Pellon, Halifax              HX2 0QB",Calderdale Mbc Children & Young People's Services,580.8,68436700,1200
,01/04/1990,"Grove House, 9a Wade House Road, Shelf, Halifax             HX3 7PF",,319.44,69216709,6600
"The Counting House, Tower Building, Wade House Road, Shelf, HX3 7PB",01/04/1990,"12a Wade House Road, Shelf, Halifax, HX3 7PB",Bostocks Boyce Welch Ltd,3146,69216711,6500
,05/10/1992,"Stores Lower Gf, Mulcture House, Mulcture Hall Road, Halifax              HX1 1SP",Calderdale Mbc,1089,65900712,2250
,01/04/1990,"Sports Ground, Norland Road, Greetland, Halifax             HX4 8PT",,2400.64,68072700,6200
,01/04/1990,"The Holme, Saddleworth Road, Greetland, Halifax             HX4 8AL",,0,68444714,5000
,01/01/1995,"Brian Royd Mills, Brian Royd Lane, Greetland, Halifax             HX4 8NF",Electro Power Engineering Ltd,0,68444724,2600
,01/04/1990,"Holme House, Wakefield Road, Lightcliffe, Halifax             HX3 8TY",,1210.78,69248700,7900
"73 Victoria Road, Elland, HX5 0QA",01/04/1990,"Walnut Street, Halifax, HX1 5JB",Percy Wood (Builders) Ltd,0,69256700,3350
"85 Riley Lane, Bradshaw, Halifax, HX2 9QE",01/04/1990,"Holmfield Industrial Estate, Holmfield, Halifax, HX2 9TN",D Midgley & Sons Ltd,5452.52,65348700,11750
"Northgate, Halifax, HX1 1XJ",01/04/1990,"North Bridge Street, Halifax, HX1 1XJ",Dews Motor Group Ltd,4065.6,68096703,8400
,01/04/1990,"Holmfield Garage, Holmfield Industrial Estate, Holmfield, Halifax             HX2 9TN",,2904,65348708,6000
,01/04/1990,"Diamond House, Old Lane, Luddenden, Halifax             HX2 6QA",,0,68136700,1425
,20/08/1998,"Unit 1 Station Industrial Pk, Station Road, Luddendenfoot, HX2 6AD",North Central Tyres Ltd,0,68144701,5100
"Shaw Royd Works, Shaw Lane, Halifax, HX3 9HD",10/11/2001,"Sedburgh Road, Halifax, HX3 9HB",W.K.W Precision Engineering Co Ltd,2032.8,68520700,4200
,01/04/1995,"Office Suite D154, Dean Clough Office Park, Halifax, HX3 5AX",,726,64788802,1500
"Office Suite E345, Dean Clough, Halifax, HX3 5AX",01/04/1996,"Office Suite D 27, Dean Clough Mills, Halifax, HX3 5AX",Dean Clough Ltd,1548.8,64788808,3200
"C/O Rate Account Management, C/O Colliers Int Rating Uk Llp, 12th Flr Eleven Brindleyplace, 2 Brunswick Square, Brindleyplace Birmingham, B1 2LP",21/03/1999,"Unit 7, Margram Business Centre, Horne Street, Halifax             HX1 5UA",Sally Salon Services Ltd,2662,65376703,5500
,01/04/1990,"Unit A, Drakes Industrial Estate, Shay Lane, Halifax             HX3 6RL",James Jackson (Hx) Ltd,4119.58,68536734,10750
,08/06/1999,"28 Illingworth Road, Illingworth, Halifax, HX2 9EN",,0,65424028,2600
"Regen & Development, Northgate House, Northgate, Halifax, HX1 1UN",01/04/1990,"Car Park, Haugh Shaw Road West, Halifax, HX1 3LE",Calderdale Mbc,2904,68180700,6000
,02/11/1999,"21/23 Park Drive, Rochdale Road, Halifax, HX2 7NP",,5687,68192021,11750
"Leisure Services, Westgate House, Westgate, Halifax, HX1 1PS",01/04/1990,"Stoney Royd Cemetery, Siddal New Road, Halifax, HX3 9HR",Director Of Safer & Stronger Communities,3630,68572700,7500
,01/05/1999,"Dyson Road, Halifax, HX1 4RJ",,0,64864702,3050
,01/04/2002,"Eldon Street, Range Lane, Halifax, HX3 6DW",Merlin Precision Engineering Ltd,696.96,65012700,7200
,01/04/1990,"Jagger Green Hall, Holywell Green, Halifax, HX4 9DE",,0,65452702,7300
,02/10/1999,"52 Keighley Road, Halifax, HX2 8AL",,1210,65484052,2500
,29/09/1997,"7 Park View, Stainland, Halifax, HX4 9HJ",,0,68220005,2800
,01/04/1992,"44/46 South Parade, Halifax, HX1 2LY",,0,68632044,4050
,05/08/1995,"229 King Cross Road, Halifax, HX1 3JL",,2081.99,65516229,8900
,03/07/1998,"251 King Cross Road, & 2 Gledhills Yard, Halifax, HX1 3JL",,0,65516702,5500
"C/O Ctil, Rate A/C Management, Colliers Int Rating Uk Llp, 12th Floor, 11 Brindley Place, 2 Brunswick Square, Brindley Place, Birmingham, B1 2LP",01/09/1998,"Telecommunications Mast, Site Ref 4628  Shroggs Farm, Sowerby Lane, Luddendenfoot        HX2 6JP",Vodafone Ltd,2758.8,68666700,5700
,21/01/2002,"Beehive & Cross Keys Inn, King Cross Street, Halifax, HX1 2SH",,0,65520700,6000
"Regen & Development, Northgate House, Northgate, Halifax, HX1 1UN",16/05/1994,"Victoria Street, Halifax, HX1 5SS",Calderdale Mbc,1306.8,68728700,2700
"991 Great West Road, Brentford, TW8 9DN",01/04/1994,"Advertising Right, 340 Gibbet Street, Halifax, HX1 4JW",J C Decaux Uk Ltd,176.66,65164340,365
,15/11/2001,"18 St James Square, Northowram, Halifax, HX3 7HL",,0,68732018,3600
,01/04/1990,"45 Stainland Road, Greetland, Halifax, HX4 8BD",,0,68772045,2850
,01/04/1990,"Unit 6, Lee Bridge Industrial Estate, Lee Bridge, Halifax             HX3 5AT",J & R Electrical Ltd,0,65600716,8000
,01/06/1993,"124 Queens Road, Halifax, HX1 3XY",,0,68308124,3600
,01/04/1990,"North Dean Garage, Stainland Road, Greetland, Halifax             HX4 8LS",North Dean Automotive Ltd,0,68772712,10750
,01/04/1990,"121 Gibbet Street, Halifax, HX1 5BP",,0,65164775,5100
"Nndr Dept, Orion Gate, Guildford Road, Woking Surrey, GU22 7NJ",01/07/2001,"Advertising Right Adj Junct., Ovenden Road/Lentilfield St, Halifax, HX3 5PT",Clear Channel (Uk) Ltd,116.16,65625700,240
,09/07/1990,"296c Queens Road, Halifax, HX1 4NS",,0,68308733,2750
"Leisure Services, Westgate House, Westgate, Halifax, HX1 1PS",01/04/1990,"Westgate Sports Ground, Stainland Road, Sowood, Stainland, Halifax              HX4 9HN",Director Of Safer & Stronger Communities,859.1,68780708,1775
"Office 1, Swalesmoor Road, Boothtown, Halifax, HX3 6UF",02/11/1997,"Beacon Lodge Quarry, Off Long Lane, Southowram, Halifax             HX3 9UD",Envirowaste Services Ltd,484,65664702,1000
,01/04/1990,"10 Luddenden Lane, Luddendenfoot, Halifax, HX2 6NH",,459.8,65716010,950
,14/07/1997,"18c Lydgate, Northowram, Halifax, HX3 7EJ",Anna's Beauty Centre Ltd,0,65728704,4500
,01/03/1997,"Stod Fold Barn Bunkhouse, Stod Fold, Mixenden, Halifax             HX2 8XL",,271.04,68854701,560
,01/04/1990,"Stump Cross Auto Services, Stump Cross, Halifax, HX3 7AB",,0,68872703,3950
"Nndr Dept, Orion Gate, Guildford Road, Woking Surrey, GU22 7NJ",01/04/2000,"Board No. 0702 0037, Stump Cross, Halifax, HX3 7AD",Clear Channel (Uk) Ltd,232.32,68872706,480
,01/04/1990,"Turn Lee Recreation Ground, Green Lane, Midgley, Halifax              HX2 6TT",,0,65200700,1150
,01/04/1990,"Greenroyd, Mount Tabor, Halifax, HX2 0UE",,0,65208700,1125
,01/04/1990,"Broad Oak, Halifax Road, Hipperholme, Halifax              HX3 8BW",,0,65232712,3700
,01/04/1990,"Thornhill Cottage, Stainland, Halifax, HX4 9LP",,696.96,69060700,7200
"Regen & Development, Northgate House, Northgate, Halifax, HX1 1UN",01/04/1990,"S/0 51 Towngate, Northowram, Halifax, HX3 7EG",Calderdale Mbc,629.2,69084703,1300
"Fao Shabbir Suleman, Westgate House, Westgate, Halifax, HX1 1PS",01/04/2001,"F/O School, Mill Bank Road, Triangle, Sowerby Bridge       HX6 3DY",Calderdale Mbc Leisure Services,261.36,77344703,540
,01/04/2000,"Height Gate Farm, Dyke Lane, Eastwood, Todmorden           OL14 6EL",,0,78144700,3500
