"Line Number","Posting Date","MCH.Merchant Category Code (MCC)","MCH.Merchant Name","FIN.Transaction Amount(£)","Description"
1,2017-07-14,9399,"CAPITA BUS SVS-MOTO",512.2,"Payment for External Training Course"
2,2017-07-14,9399,"CAPITA BUS SVS-MOTO",512.2,"Payment for External Training Course"
3,2017-07-14,5943,"WWW.STAPLES.CO.UK",529,"Payment for specialist equipment for a staff member"
4,2017-06-21,7399,"EB  DYNAMO 17-TECH BOO",518.4,"Payment for Digital staff to attend a conference and networking event"
5,2017-06-21,7399,"EB  DYNAMO 17-TECH BOO",518.4,"Payment for Digital staff to attend a conference and networking event"
